name,url,description,category,neighborhood,address,phone,rating,google_maps_url,links_on_site,scraped_at
"Best Supermarkets in Addis Ababa, Ethiopia 2025",https://livingethio.com/site/blog/best-supermarkets-in-addis-ababa-ethiopia-2025,"The layout is clean and easy to navigate — perfect for quick stops or full grocery hauls. No relation to the American Safeway, but just as impressive! Safeway Supermarket in Addis Ababa ...",Supermarket,Bole,,,,https://www.google.com/maps/search/?api=1&query=Best+Supermarkets+in+Addis+Ababa%2C+Ethiopia+2025+Bole+Addis+Ababa+Ethiopia,https://t.me/liveethiosupport | https://www.facebook.com/liveethiorealestate/ | https://www.instagram.com/live.ethio/ | https://www.linkedin.com/company/live-ethio-real-estate/,2026-05-10T12:33:36.630339+00:00
Where are the best places for shopping groceries in Addis Ababa? - Quora,https://www.quora.com/Where-are-the-best-places-for-shopping-groceries-in-Addis-Ababa,"Fantu Supermarket (Bole and other locations): good fresh produce section and household items; competitively priced. Elfora Market: large modern supermarket with wide selecti ... Addis Ababa offers a mix of modern supermarkets, specialty stores, ...",Supermarket,Bole,,,,https://www.google.com/maps/search/?api=1&query=Where+are+the+best+places+for+shopping+groceries+in+Addis+Ababa%3F+-+Quora+Bole+Addis+Ababa+Ethiopia,,2026-05-10T12:33:36.630339+00:00
Supermarkets in Addis Ababa in Ethiopia,https://map.et/addis-ababa/supermarkets,Addis Ababa is the capital city of Ethiopia.,Supermarket,Bole,,,,https://www.google.com/maps/search/?api=1&query=Supermarkets+in+Addis+Ababa+in+Ethiopia+Bole+Addis+Ababa+Ethiopia,https://map.et/addis-ababa | https://map.et/addis-ketema/supermarkets | https://map.et/akaki-kaliti/supermarkets | https://map.et/arada/supermarkets | https://map.et/bole/supermarkets | https://map.et/ethiopia/supermarkets | https://map.et/gulale/supermarkets | https://map.et/kirkos/supermarkets | https://map.et/kolfe-keranio/supermarkets | https://map.et/lideta/supermarkets,2026-05-10T12:33:36.630339+00:00
Supermarkets in Addis Ababa - AddisMap Map & City-Guide (2026),https://www.addismap.com/supermarkets,"Interactive Map of Supermarkets in Addis Ababa, Ethiopia",Supermarket,Bole,,+251 911984622,,https://www.google.com/maps/search/?api=1&query=Supermarkets+in+Addis+Ababa+-+AddisMap+Map+%26+City-Guide+%282026%29+Bole+Addis+Ababa+Ethiopia,https://www.facebook.com/addismap/ | https://www.twitter.com/addismap/,2026-05-10T12:33:36.630339+00:00
Novis Ethiopia,https://www.novisethiopia.com/,"Express Travel is proud to serve big companies such as Coca Cola, and The British Council and organizes tours in Ethiopia and leisure or business travel all around the world! In an effort to provide even high quality to its clients, Novis bought a farm conveniently located in Debre Zeit. There cows are grass fed and fattened to serve our clients, both retail and wholes sale, with the softest meat you can buy in Addis Ababa! We are happy to serve all international passengers passing by the Bole International Airport with our 18m2 minimarket!",Supermarket,Bole,,,,https://www.google.com/maps/search/?api=1&query=Novis+Ethiopia+Bole+Addis+Ababa+Ethiopia,https://thefoodboutiquenovis.com/ | https://www.zfreelancers.com/,2026-05-10T12:33:36.630339+00:00
r/Ethiopia on Reddit: Cheap supermarket?,https://www.reddit.com/r/Ethiopia/comments/15df8ee/cheap_supermarket/,Try Queens supermarket. There is one near Meskel Square/Stadium around which is maybe 10-15 minutes from Bole.,Supermarket,Bole,,,,https://www.google.com/maps/search/?api=1&query=r%2FEthiopia+on+Reddit%3A+Cheap+supermarket%3F+Bole+Addis+Ababa+Ethiopia,,2026-05-10T12:33:36.630339+00:00
The Rise of Supermarkets in Addis – Ethiopian Business Review,https://ethiopianbusinessreview.net/the-rise-of-supermarkets-in-addis/,"Other chains have experienced similar success. Worku Tadesse, manager of the Friendship Supermarket in Bole, concurs with Melaku’s assessment about the dramatic change occurring in supermarket shopping.",Supermarket,Bole,,,,https://www.google.com/maps/search/?api=1&query=The+Rise+of+Supermarkets+in+Addis+%E2%80%93+Ethiopian+Business+Review+Bole+Addis+Ababa+Ethiopia,https://t.me/ebr_news | https://twitter.com/EBRnews | https://twitter.com/intent/tweet?text=https://ethiopianbusinessreview.net/the-rise-of-supermarkets-in-addis/ | https://www.facebook.com/EthiopianBusinessReview | https://www.facebook.com/sharer/sharer.php?u=https://ethiopianbusinessreview.net/the-rise-of-supermarkets-in-addis/ | https://www.linkedin.com/company/ebr-2013 | https://www.linkedin.com/company/ebr-2013/ | https://www.linkedin.com/shareArticle?url=https://ethiopianbusinessreview.net/the-rise-of-supermarkets-in-addis/,2026-05-10T12:33:36.630339+00:00
Safeway Supermarket – Modern Addis,https://modernaddis.com/listings/safeway-supermarket/,Contact: Phone: +251 4712196/99 +251 6393995 (Atlas Branch) +25116682400 (Summit) +251947939393 (Gerji) Mobile: 0935101361/0935401357/0947969696 0947030303 (Atlas Branch) 09479040404 (Café Bonjour Branch) Email: info@safewaysupermarket.com ...,Supermarket,Bole,,+251 4712196,,https://www.google.com/maps/search/?api=1&query=Safeway+Supermarket+%E2%80%93+Modern+Addis+Bole+Addis+Ababa+Ethiopia,https://modernaddis.com/ | https://modernaddis.com/about-us/ | https://modernaddis.com/add-listing/ | https://modernaddis.com/advertising/ | https://modernaddis.com/blog/ | https://modernaddis.com/contact/ | https://modernaddis.com/copyright | https://modernaddis.com/events/ | https://modernaddis.com/featured-listings/ | https://modernaddis.com/listing-category/shopping-stores/,2026-05-10T12:33:36.630339+00:00
List of all Supermarkets in Addis Ababa (Addis Abeba) - D7 Lead Finder,https://d7leadfinder.com/app/view-leads/39042958/,"Find Supermarkets leads in Addis Ababa and surrounding areas, including contact information, business websites and social media profiles for all Supermarkets in Addis Ababa.",Supermarket,Bole,,,,https://www.google.com/maps/search/?api=1&query=List+of+all+Supermarkets+in+Addis+Ababa+%28Addis+Abeba%29+-+D7+Lead+Finder+Bole+Addis+Ababa+Ethiopia,,2026-05-10T12:33:36.630339+00:00
"Supermarkets in Bole Subcity in Addis Ababa, Ethiopia",https://map.et/bole/supermarkets,"A large shop selling groceries, fresh produce, and other goods · Bole Subcity is around the international airport and a vibrant part of the city",Supermarket,Bole,,,,https://www.google.com/maps/search/?api=1&query=Supermarkets+in+Bole+Subcity+in+Addis+Ababa%2C+Ethiopia+Bole+Addis+Ababa+Ethiopia,https://map.et/addis-ababa/supermarkets | https://map.et/bole | https://map.et/n10013368534/chinatown-market | https://map.et/n10184621945/abrish-mitadabrs-mtad | https://map.et/n11466749869/haymi-marthomedelivery | https://map.et/n1697757589/fantu-super-market | https://map.et/n1962218674/all-mart | https://map.et/n3223454013/besha-mini | https://map.et/n3293032955/fresh-corner | https://map.et/n3293032956/gorgeous-fine-foods,2026-05-10T12:33:36.630339+00:00
Shi Abebayehu Supermarket - ShebaMiles - Ethiopian Airlines,https://shebamiles.ethiopianairlines.com/partners/shopping/shi-abebayehu-supermarket,ShebaMiles members can earn miles for their purchases at Shi Abebayehu supermarket. Provide your membership number when you pay your bill to earn Miles. Note: There is no restriction on type of items purchased for mile earning.,Supermarket,Bole,Bole Sub City,,,https://www.google.com/maps/search/?api=1&query=Shi+Abebayehu+Supermarket+-+ShebaMiles+-+Ethiopian+Airlines+Bole+Addis+Ababa+Ethiopia,https://instagram.com/fly.ethiopian | https://twitter.com/flyethiopian | https://www.facebook.com/ethiopianairlines | https://www.linkedin.com/company/ethiopian-airlines,2026-05-10T12:33:36.630339+00:00
Lomyad Supermarket,https://www.lomyadsupermarket.com/,"Lomyad Supermarket - Your trusted source for fresh groceries, quality products, and exceptional service in Addis Ababa.",Supermarket,Bole,,,,https://www.google.com/maps/search/?api=1&query=Lomyad+Supermarket+Bole+Addis+Ababa+Ethiopia,https://t.me/LomyadSupermarketOfficial | https://web.facebook.com/p/Lomyad-Supermarket-and-Daily-Fresh-100057578584176/?_rdc=1&_rdr#,2026-05-10T12:33:36.630339+00:00
Supermarkets in Addis Ababa Ethiopia | AddisBiz.com (አዲስ ቢዝ) - Ethiopian Business Directory and Portal,https://addisbiz.com/business-directory/shopping/supermarkets?city=Addis+Ababa,ASEFASH SUPERMARKET Mobile : +25191151...,Supermarket,Bole,,,,https://www.google.com/maps/search/?api=1&query=Supermarkets+in+Addis+Ababa+Ethiopia+%7C+AddisBiz.com+%28%E1%8A%A0%E1%8B%B2%E1%88%B5+%E1%89%A2%E1%8B%9D%29+-+Ethiopian+Business+Directory+and+Portal+Bole+Addis+Ababa+Ethiopia,https://facebook.com | https://instagram.com | https://twitter.com,2026-05-10T12:33:36.630339+00:00
asbeza: Grocery delivery service in Addis Ababa,https://asbeza.net/,Ethiopia&#x27;s #1 online grocery delivery service featuring some of the best supermarkets in Addis Ababa.,Supermarket,Bole,,+251911249048,,https://www.google.com/maps/search/?api=1&query=asbeza%3A+Grocery+delivery+service+in+Addis+Ababa+Bole+Addis+Ababa+Ethiopia,,2026-05-10T12:33:36.630339+00:00
Groceries Delivery | AradaMart | አዲስ አበባ Online shopping in ethiopia,https://www.aradamart.net/,አራዳ ማርት I በቅናሽ ይገብዮ! Groceries Home Delivery Starting at 299br/month Only! AradaMart Shopping,Supermarket,Bole,,,,https://www.google.com/maps/search/?api=1&query=Groceries+Delivery+%7C+AradaMart+%7C+%E1%8A%A0%E1%8B%B2%E1%88%B5+%E1%8A%A0%E1%89%A0%E1%89%A3+Online+shopping+in+ethiopia+Bole+Addis+Ababa+Ethiopia,http://t.me/Arada_Mart | https://www.facebook.com/aradamart.net | https://www.linkedin.com/company/aradamart | https://www.twitter.com/aradamart,2026-05-10T12:33:36.630339+00:00
"Addis Ababa, Ethiopia - How would you describe the availability and cost of groceries and household supplies relative to your home country?",https://www.talesmag.com/real-post-report-city-question-answers/58/16,"Fruit and vegetables are limited and the quality is just ok. Fresh Corner, a local store, seems to be the best place for fruit and vegetables. They are located in Old Airport and Bole.",Supermarket,Bole,,,,https://www.google.com/maps/search/?api=1&query=Addis+Ababa%2C+Ethiopia+-+How+would+you+describe+the+availability+and+cost+of+groceries+and+household+supplies+relative+to+your+home+country%3F+Bole+Addis+Ababa+Ethiopia,https://www.facebook.com/pages/Tales-from-a-Small-Planet/48604147269,2026-05-10T12:33:36.630339+00:00
Super Markets - Addis Ababa,https://www.2merkato.com/directory/473/,This category of the business directory contains the list of service providers who are engaged in Super Markets service in Ethiopia. Start · Prev · 1 · 2 · Next · End · Results 1 - 20 of 26 · Add your business here · Lewis Retails (Bambis) is a wholesale and retail company that has ...,Supermarket,Bole,,,,https://www.google.com/maps/search/?api=1&query=Super+Markets+-+Addis+Ababa+Bole+Addis+Ababa+Ethiopia,http://twitter.com/2merkato | http://www.facebook.com/2merkato,2026-05-10T12:33:36.630339+00:00
"Top 86 Supermarket in Addis Ababa, Ethiopia - Apr 2026",https://www.ethyp.com/category/Supermarket/city:Addis_Ababa,"List of top verified Supermarket in Addis Ababa, Ethiopia, near me.",Supermarket,Bole,,,,https://www.google.com/maps/search/?api=1&query=Top+86+Supermarket+in+Addis+Ababa%2C+Ethiopia+-+Apr+2026+Bole+Addis+Ababa+Ethiopia,https://www.facebook.com/I-Love-Ethiopia-107975795124980 | https://www.linkedin.com/company/ethiopia-business-directory/,2026-05-10T12:33:36.630339+00:00
Ethiopia's Grocery Sector is Rapidly Expanding,https://apps.fas.usda.gov/newgainapi/api/Report/DownloadReportByFileName?fileName=Ethiopia%E2%80%99s+Grocery+Sector+is+Rapidly+Expanding_Addis+Ababa_Ethiopia_8-18-2016.pdf,"Eight major supermarket chains, with a total of 21 stores, are open across Addis Ababa. The major food · retail stores – Shoa, Fantu, Safeway, Friendship, Bambis, All-Mart, Novis, and Loyal – supply a wide · array of products, most of which are imported foods and beverages. In addition to these major players, there are mid and smaller-sized stores. See table 1 for listing of Ethiopian ...",Supermarket,Bole,,,,https://www.google.com/maps/search/?api=1&query=Ethiopia%27s+Grocery+Sector+is+Rapidly+Expanding+Bole+Addis+Ababa+Ethiopia,,2026-05-10T12:33:39.298812+00:00
Supermarkets in Addis-ababa Ethiopia | AddisBiz.com (አዲስ ቢዝ) - Ethiopian Business Directory and Portal,https://addisbiz.com/business-directory/shopping/supermarkets?city=addis-ababa&page=4,List of Supermarkets in Addis-ababa Ethiopia | AddisBiz.com (አዲስ ቢዝ) - Ethiopian Business Directory and Portal,Supermarket,Bole,,,,https://www.google.com/maps/search/?api=1&query=Supermarkets+in+Addis-ababa+Ethiopia+%7C+AddisBiz.com+%28%E1%8A%A0%E1%8B%B2%E1%88%B5+%E1%89%A2%E1%8B%9D%29+-+Ethiopian+Business+Directory+and+Portal+Bole+Addis+Ababa+Ethiopia,https://facebook.com | https://instagram.com | https://twitter.com,2026-05-10T12:33:39.298812+00:00
"FANTU SUPERMARKET Company Profile | Addia Ababa, Addis Ababa | Competitors, Financials & Contacts - Dun & Bradstreet",https://www.dnb.com/business-directory/company-profiles.fantu_supermarket.aef1888bc46e2c370e00c07aa51cc88c.html,"FANTU SUPERMARKET is located at On the way Airport road, Bole woreda 03 Addia Ababa, Addis Ababa Ethiopia",Supermarket,Bole,,,,https://www.google.com/maps/search/?api=1&query=FANTU+SUPERMARKET+Company+Profile+%7C+Addia+Ababa%2C+Addis+Ababa+%7C+Competitors%2C+Financials+%26+Contacts+-+Dun+%26+Bradstreet+Bole+Addis+Ababa+Ethiopia,,2026-05-10T12:33:39.298812+00:00
Supermarkets,https://eoiaddisababa.gov.in/wp-content/uploads/2023/09/Supermarkets.docx,PK,Supermarket,Bole,,,,https://www.google.com/maps/search/?api=1&query=Supermarkets+Bole+Addis+Ababa+Ethiopia,,2026-05-10T12:33:39.298812+00:00
Supermarket Contacts in Addis Ababa | PDF | Food Retailers,https://www.scribd.com/document/692080484/Supermarkets,"JavaScript is disabled in your browser · Please enable JavaScript to proceed · A required part of this site couldn’t load. This may be due to a browser extension, network issues, or browser settings. Please check your connection, disable any ad blockers, or try using a different browser",Supermarket,Bole,,,,https://www.google.com/maps/search/?api=1&query=Supermarket+Contacts+in+Addis+Ababa+%7C+PDF+%7C+Food+Retailers+Bole+Addis+Ababa+Ethiopia,,2026-05-10T12:33:39.298812+00:00
Explore the Vibrant Shoa Supermarket in Addis Ababa,https://evendo.com/locations/ethiopia/shewa/shop/shoa-supermarket,"Experience the warmth of Ethiopian ... experiences in Addis Ababa. ... Discover the relaxed charm of Kiss Addis, a premier lounge in Bole, perfect for unwinding and enjoying a taste of Ethiopia&#x27;s vibrant nightlife. ... Discover Shoa supermarket with Evendo, a 100% free app-based ...",Supermarket,Bole,,,,https://www.google.com/maps/search/?api=1&query=Explore+the+Vibrant+Shoa+Supermarket+in+Addis+Ababa+Bole+Addis+Ababa+Ethiopia,https://www.facebook.com/evendo.global/ | https://www.instagram.com/evendo_events/,2026-05-10T12:33:39.298812+00:00
Supermarkets and Shops - Welcome 2 Addis,https://welcome2addis.com/supermarkets-and-shops/,"Supermarkets and Shops Addis Ababa is not a well stocked city. Due to limitations on imports, many things are hard to find and often expensive. In addition, following the currency realignment in July 2024, there has been huge inflation. Garlic, for example, has gone from 30 Birr per kilo to ...",Supermarket,Bole,,,,https://www.google.com/maps/search/?api=1&query=Supermarkets+and+Shops+-+Welcome+2+Addis+Bole+Addis+Ababa+Ethiopia,https://www.linkedin.com/in/muliemes,2026-05-10T12:33:39.298812+00:00
List Of Supermarkets in Addis Ababa,https://rentechdigital.com/smartscraper/business-report-details/ethiopia/list-of-supermarkets-in-addis-ababa,Download the list of Supermarkets in Addis Ababa. Smartscrapers provides an accurate directory and the latest data on the number of Supermarkets in Addis Ababa,Supermarket,Bole,,,,https://www.google.com/maps/search/?api=1&query=List+Of+Supermarkets+in+Addis+Ababa+Bole+Addis+Ababa+Ethiopia,https://twitter.com/DigitalRentech | https://www.facebook.com/RentechDigital/ | https://www.instagram.com/rentechdigital/ | https://www.linkedin.com/company/rentech-digital,2026-05-10T12:33:39.298812+00:00
Supermarkets in Ethiopia | AddisBiz.com (አዲስ ቢዝ) - Ethiopian Business Directory and Portal,https://addisbiz.com/business-directory/shopping/supermarkets,List of Supermarkets in Ethiopia | AddisBiz.com (አዲስ ቢዝ) - Ethiopian Business Directory and Portal,Supermarket,Bole,,,,https://www.google.com/maps/search/?api=1&query=Supermarkets+in+Ethiopia+%7C+AddisBiz.com+%28%E1%8A%A0%E1%8B%B2%E1%88%B5+%E1%89%A2%E1%8B%9D%29+-+Ethiopian+Business+Directory+and+Portal+Bole+Addis+Ababa+Ethiopia,https://facebook.com | https://instagram.com | https://twitter.com,2026-05-10T12:33:39.298812+00:00
"Addis Ababa, Ethiopia | Where will I buy groceries and do other shopping in Addis Ababa? | Expat Exchange",https://www.expatexchange.com/gdcviewtr/87/1/378/4698/Ethiopia/Addis-Ababa/Where-will-I-buy-groceries-and-do-other-shopping-in-Addis-Ababa,"When we asked people living in Addis Ababa about good local restaurants, they mentioned...",Supermarket,Bole,,,,https://www.google.com/maps/search/?api=1&query=Addis+Ababa%2C+Ethiopia+%7C+Where+will+I+buy+groceries+and+do+other+shopping+in+Addis+Ababa%3F+%7C+Expat+Exchange+Bole+Addis+Ababa+Ethiopia,https://www.facebook.com/TheExpatExchange | https://www.instagram.com/realexpatexchange | https://www.linkedin.com/company/expat-exchange,2026-05-10T12:33:39.299821+00:00
Shoa Shopping Center,https://shoashopping.org/,Summit CMC Bole Arabsa Megnaga HyperMarket BoleWeloSefer Near Japan Embassy Rakan Atlas Bulbula Tulu Dimtu · Discover our conveniently located branches in West Addis Ababa!,Supermarket,Bole,,,,https://www.google.com/maps/search/?api=1&query=Shoa+Shopping+Center+Bole+Addis+Ababa+Ethiopia,https://t.me/ShoaShoppingCenterOfficial | https://www.facebook.com/shoashopping | https://www.instagram.com/shoa_shopping,2026-05-10T12:33:39.299821+00:00
Deliver Addis - Market,https://deliveraddis.com/market/full,"It looks like you already have some items in your basket from . If you would like to create a new order from instead, your previous basket from will be deleted · Please login or create an account",Supermarket,Bole,,,,https://www.google.com/maps/search/?api=1&query=Deliver+Addis+-+Market+Bole+Addis+Ababa+Ethiopia,https://twitter.com/deliveraddis | https://www.facebook.com/deliveraddis | https://www.instagram.com/deliveraddis/,2026-05-10T12:33:39.299821+00:00
Retailing and Supermarkets Trading | MIDROC Investment Group,https://www.midrocinvestmentgroup.com/merchandize-wholesale-retailing-and-supermarkets-trading/,"This part of Ethiopia is considered to be the home of Coffee arabica. Here one finds the optimum soil and climatic condition which nature seems to have it designed for coffee production. The farm covers a total of 1,574 ha. of which 1,000 hectares is under coffee plantation, 400 ha. which are hills and gorges remain ... covered with indigenous forest trees and shrubs. Distance from Addis Ababa...",Supermarket,Bole,,,,https://www.google.com/maps/search/?api=1&query=Retailing+and+Supermarkets+Trading+%7C+MIDROC+Investment+Group+Bole+Addis+Ababa+Ethiopia,https://www.facebook.com/110005684872662/posts/118840077322556/?app=fbl,2026-05-10T12:33:39.299821+00:00
"Ethio Supermarket, Addis Ababa, Ethiopia - Reviews, Ratings, Tips and Why You Should Go – Wanderlog",https://wanderlog.com/place/details/10095637/ethio-supermarket,"If you&#x27;re on the lookout for a fantastic local shopping experience, Ethio Supermarket is a must-visit. This vibrant supermarket offers everything you could possibly need, from everyday groceries to unique items. What sets it apart is its delightful fast food wrap section, where you&#x27;ll find ...",Supermarket,Bole,,,,https://www.google.com/maps/search/?api=1&query=Ethio+Supermarket%2C+Addis+Ababa%2C+Ethiopia+-+Reviews%2C+Ratings%2C+Tips+and+Why+You+Should+Go+%E2%80%93+Wanderlog+Bole+Addis+Ababa+Ethiopia,https://wanderlog.app.link/?%24canonical_url=https%3A%2F%2Fapp.wanderlog.com%2FdeepLink%2F%3F&%24ios_nativelink=false&%24desktop_url=https%3A%2F%2Fapps.apple.com%2Fus%2Fapp%2Fwanderlog%2Fid1476732439&%24og_image_url=https%3A%2F%2Fwanderlog.com%2Fassets%2Flogo.png | https://wanderlog.app.link/?%24canonical_url=https%3A%2F%2Fapp.wanderlog.com%2FdeepLink%2F%3F&%24ios_nativelink=false&%24desktop_url=https%3A%2F%2Fplay.google.com%2Fstore%2Fapps%2Fdetails%3Fid%3Dcom.wanderlog.android&%24og_image_url=https%3A%2F%2Fwanderlog.com%2Fassets%2Flogo.png | https://wanderlog.app.link/?%24canonical_url=https%3A%2F%2Fapp.wanderlog.com%2FdeepLink%2F%3Futm_medium%3Donsite%26utm_content%3DinOneView%26utm_campaign%3DplacePage&%24ios_nativelink=false&%24ios_url=https%3A%2F%2Fapps.apple.com%2Fapp%2Fapple-store%2Fid1476732439%3Fpt%3D128458617%26ct%3Dc%253AplacePage%252Cct%253AinOneView%252Cm%253Aonsite%26mt%3D8&%24desktop_url=https%3A%2F%2Fapps.apple.com%2Fapp%2Fapple-store%2Fid1476732439%3Fpt%3D128458617%26ct%3Dc%253AplacePage%252Cct%253AinOneView%252Cm%253Aonsite%26mt%3D8&%24og_image_url=https%3A%2F%2Fwanderlog.com%2Fassets%2Flogo.png&~feature=onsite&~campaign=placePage&~tags=inOneView | https://wanderlog.app.link/?%24canonical_url=https%3A%2F%2Fapp.wanderlog.com%2FdeepLink%2F%3Futm_medium%3Donsite%26utm_content%3DultimateItinerary%26utm_campaign%3DplacePage&%24ios_nativelink=false&%24ios_url=https%3A%2F%2Fapps.apple.com%2Fapp%2Fapple-store%2Fid1476732439%3Fpt%3D128458617%26ct%3Dc%253AplacePage%252Cct%253AultimateItinerary%26mt%3D8&%24desktop_url=https%3A%2F%2Fapps.apple.com%2Fapp%2Fapple-store%2Fid1476732439%3Fpt%3D128458617%26ct%3Dc%253AplacePage%252Cct%253AultimateItinerary%26mt%3D8&%24og_image_url=https%3A%2F%2Fwanderlog.com%2Fassets%2Flogo.png&~feature=onsite&~campaign=placePage&~tags=ultimateItinerary | https://wanderlog.com/ | https://wanderlog.com/api/places/redirectToFirstSearchResult/site%3Atripadvisor.com%20Ethio%20Supermarket%20/6ec502cdcbbab557ebd5831e5399c914756bf8f594b755a69de6ce138d206eea | https://wanderlog.com/blog/ | https://wanderlog.com/blog/jobs/ | https://wanderlog.com/cat | https://wanderlog.com/dmca,2026-05-10T12:33:39.299821+00:00
Queen's Supermarket | Gurd Shola - Hulunem,https://hulunem.com/place/ethiopia/addis-ababa/addis-ababa/queens-supermarket/,Queen’s Supermarket is the premier shopping destination that caters to all your grocery and household needs in Addis Ababa.,Supermarket,Bole,you visit. Queen’s Supermarket offers a vast array of produc,,,https://www.google.com/maps/search/?api=1&query=Queen%27s+Supermarket+%7C+Gurd+Shola+-+Hulunem+Bole+Addis+Ababa+Ethiopia,https://t.me/hulunemChannel | https://twitter.com/share?url=https%3A%2F%2Fhulunem.com%2Fplace%2Fethiopia%2Faddis-ababa%2Faddis-ababa%2Fqueens-supermarket-gurd-shola%2F | https://www.facebook.com/hulunem1/ | https://www.facebook.com/sharer/sharer.php?u=https%3A%2F%2Fhulunem.com%2Fplace%2Fethiopia%2Faddis-ababa%2Faddis-ababa%2Fqueens-supermarket-gurd-shola%2F | https://www.instagram.com/hulunem_/ | https://www.linkedin.com/shareArticle?mini=true&url=https%3A%2F%2Fhulunem.com%2Fplace%2Fethiopia%2Faddis-ababa%2Faddis-ababa%2Fqueens-supermarket-gurd-shola%2F,2026-05-10T12:33:39.299821+00:00
"All Mart Supermarket | Gerji | ኦልማርት ሱፐር ማርኬት | ገርጂ - Reviews, Photos & Phone Number - Updated November 2025 - Supermarkets in Addis Ababa, Ethiopia - Wheree",https://all-mart-supermarket-gerji-olmart-supermarket-gerji.wheree.com/,All Mart Supermarket | Gerji | ኦልማርት ሱፐር ማርኬት | ገርጂ is a popular retail store offering a wide range of groceries and everyday essentials to the local community. ...,Supermarket,Bole,and quality products,+251 1162-958-76,,https://www.google.com/maps/search/?api=1&query=All+Mart+Supermarket+%7C+Gerji+%7C+%E1%8A%A6%E1%88%8D%E1%88%9B%E1%88%AD%E1%89%B5+%E1%88%B1%E1%8D%90%E1%88%AD+%E1%88%9B%E1%88%AD%E1%8A%AC%E1%89%B5+%7C+%E1%8C%88%E1%88%AD%E1%8C%82+-+Reviews%2C+Photos+%26+Phone+Number+-+Updated+November+2025+-+Supermarkets+in+Addis+Ababa%2C+Ethiopia+-+Wheree+Bole+Addis+Ababa+Ethiopia,,2026-05-10T12:33:39.299821+00:00
Shoa Supermarket – Modern Addis,https://modernaddis.com/listings/shoa-supermarket/,"Shoa Shopping center is one of the biggest shops in the country providing convenient goods, fresh dairy products, vegetables and other shopping materials with quality and kind. Our slogan is “servi…",Supermarket,Bole,Piassa,,,https://www.google.com/maps/search/?api=1&query=Shoa+Supermarket+%E2%80%93+Modern+Addis+Bole+Addis+Ababa+Ethiopia,http://+25111+550+6104+ ++25111+551+5238+++++++++++++++++++++++251111552799 | https://modernaddis.com/ | https://modernaddis.com/about-us/ | https://modernaddis.com/add-listing/ | https://modernaddis.com/advertising/ | https://modernaddis.com/blog/ | https://modernaddis.com/contact/ | https://modernaddis.com/copyright | https://modernaddis.com/events/ | https://modernaddis.com/featured-listings/,2026-05-10T12:33:39.299821+00:00
r/Ethiopia on Reddit: International Supermarkets Addis,https://www.reddit.com/r/Ethiopia/comments/1r4ljze/international_supermarkets_addis/,Can anyone recommend a big supermarket in Addis that stocks a lot of international products at a reasonable price? What are your favorite big…,Supermarket,Bole,,,,https://www.google.com/maps/search/?api=1&query=r%2FEthiopia+on+Reddit%3A+International+Supermarkets+Addis+Bole+Addis+Ababa+Ethiopia,,2026-05-10T12:33:39.299821+00:00
Supermarket Ethiopia,https://www.tiktok.com/discover/supermarket-ethiopia,We cannot provide a description for this page right now,Supermarket,Bole,,,,https://www.google.com/maps/search/?api=1&query=Supermarket+Ethiopia+Bole+Addis+Ababa+Ethiopia,,2026-05-10T12:33:39.299821+00:00
