name,url,description,category,neighborhood,address,phone,rating,google_maps_url,links_on_site,scraped_at
Nifas Silk-Lafto: The Emerging District of Addis Ababa,https://ethioall.com/nifas-silk-lafto-the-emerging-district-of-addis-ababa/,"With the expansion of its industrial zones and residential neighborhoods, Nifas Silk-Lafto has become a hotspot for new businesses. From small shops and cafes to larger enterprises, the district is becoming increasingly commercialized, offering new opportunities for entrepreneurs and investors alike. Unlike some of the more urbanized parts of Addis Ababa, Nifas Silk-Lafto retains a sense of natural beauty, with green spaces that add to the quality of life for its residents.",Supermarket,Nifas Silk Lafto,,,,https://www.google.com/maps/search/?api=1&query=Nifas+Silk-Lafto%3A+The+Emerging+District+of+Addis+Ababa+Nifas+Silk+Lafto+Addis+Ababa+Ethiopia,https://date.ethioall.com | https://ethioall.com | https://ethioall.com/ | https://ethioall.com/about | https://ethioall.com/arada-the-heart-of-addis-ababa/ | https://ethioall.com/arada-the-heart-of-addis-ababa/?noamp=mobile#respond | https://ethioall.com/author/amredin/ | https://ethioall.com/blog | https://ethioall.com/category/ethiopia/addis-ababa/ | https://ethioall.com/contact,2026-05-10T12:35:12.758176+00:00
Nifas silk lafto Sub City Wereda 01 Administrative Office (admini...,"https://et.geoview.info/nifas_silk_lafto_sub_city_wereda_01_administrative_office,201768509w",Nifas silk lafto Sub City Wereda 01 Administrative Office - administrative · OSM way 201768509 · near Nefas Silk Lafto · country ET. Browse OpenStreetMap ...,Supermarket,Nifas Silk Lafto,,,,https://www.google.com/maps/search/?api=1&query=Nifas+silk+lafto+Sub+City+Wereda+01+Administrative+Office+%28admini...+Nifas+Silk+Lafto+Addis+Ababa+Ethiopia,,2026-05-10T12:35:12.758176+00:00
"Visit Nifas Silk-Lafto: 2026 Nifas Silk-Lafto, Addis Ababa Travel Guide | Expedia",https://www.expedia.co.jp/en/Addis-Ababa-Nifas-Silk-Lafto.dx553248633981729591,"Hotels in Nifas Silk-LaftoFlights to Addis AbabaCar Rentals in Nifas Silk-LaftoNifas Silk-Lafto Travel Guide · Go to any Ethiopian restaurant across the country and ask for a beyayenetu aka fasting platter... so many flavours in one meal 😋 I learnt that for almost 200 days of the year, people across Ethiopia fast - which basically means they eat no animal products.",Supermarket,Nifas Silk Lafto,,,,https://www.google.com/maps/search/?api=1&query=Visit+Nifas+Silk-Lafto%3A+2026+Nifas+Silk-Lafto%2C+Addis+Ababa+Travel+Guide+%7C+Expedia+Nifas+Silk+Lafto+Addis+Ababa+Ethiopia,,2026-05-10T12:35:12.758176+00:00
About: Nifas Silk-Lafto,https://dbpedia.org/page/Nifas_Silk-Lafto,District of Addis Ababa in Ethiopia,Supermarket,Nifas Silk Lafto,,,,https://www.google.com/maps/search/?api=1&query=About%3A+Nifas+Silk-Lafto+Nifas+Silk+Lafto+Addis+Ababa+Ethiopia,http://am.dbpedia.org/resource/ንፋስ_ስልክ_ላፍቶ | http://commons.wikimedia.org/wiki/Special:FilePath/Nifas_Silk-Lafto_(Addis_Ababa_Map).png | http://commons.wikimedia.org/wiki/Special:FilePath/Nifas_Silk-Lafto_(Addis_Ababa_Map).png?width=300 | http://creativecommons.org/licenses/by-sa/4.0/ | http://dbpedia.org | http://dbpedia.org/data/Nifas_Silk-Lafto.atom | http://dbpedia.org/data/Nifas_Silk-Lafto.jsod | http://dbpedia.org/data/Nifas_Silk-Lafto.json | http://dbpedia.org/data/Nifas_Silk-Lafto.n3 | http://dbpedia.org/data/Nifas_Silk-Lafto.ntriples,2026-05-10T12:35:12.758176+00:00
Addis Ababa Civil Registration and Residency Service Agency | Subcity Details,https://aacrrsa.gov.et/subcity/nifas-silk-lafto,The Nifas Silk Lafto Subcity Office Adminstration is located around Haile garment.,Supermarket,Nifas Silk Lafto,,,,https://www.google.com/maps/search/?api=1&query=Addis+Ababa+Civil+Registration+and+Residency+Service+Agency+%7C+Subcity+Details+Nifas+Silk+Lafto+Addis+Ababa+Ethiopia,https://www.facebook.com/profile.php?id=100064083391686 | https://www.instagram.com/aacrrsa_head_office/,2026-05-10T12:35:12.758176+00:00
"Plazas / Complexes / Malls in Nifas Silk-Lafto, Addis Ababa | Ethiopia Property Centre",https://ethiopiapropertycentre.com/commercial/plaza-complex-mall/addis-ababa/nifas-silk-lafto/showtype,"List of Plazas / Complexes / Malls for Rent &amp; Sale in Nifas Silk-Lafto, Addis Ababa State - Ethiopian Real Estate &amp; Property",Supermarket,Nifas Silk Lafto,,,,https://www.google.com/maps/search/?api=1&query=Plazas+%2F+Complexes+%2F+Malls+in+Nifas+Silk-Lafto%2C+Addis+Ababa+%7C+Ethiopia+Property+Centre+Nifas+Silk+Lafto+Addis+Ababa+Ethiopia,https://facebook.com/share.php?u=https%3A%2F%2Fethiopiapropertycentre.com%2Fcommercial%2Fplaza-complex-mall%2Faddis-ababa%2Fnifas-silk-lafto%2Fshowtype%3Futm_source%3Dfacebook%26utm_medium%3Dsharing%26utm_campaign%3DSocial%2BButtons | https://twitter.com/ETPropertyCntr | https://twitter.com/intent/tweet?text=Plazas+%2F+Complexes+%2F+Malls+in+Nifas+Silk-Lafto%2C+Addis+Ababa+%7C+Ethiopia+Property+Centre&url=https%3A%2F%2Fethiopiapropertycentre.com%2Fcommercial%2Fplaza-complex-mall%2Faddis-ababa%2Fnifas-silk-lafto%2Fshowtype%3Futm_source%3Dtwitter%26utm_medium%3Dsharing%26utm_campaign%3DSocial%2BButtons | https://www.facebook.com/EthiopiaPropertyCentre | https://www.linkedin.com/company/ethiopia-property-centre,2026-05-10T12:35:12.758176+00:00
Nifas Silk Lafto Youth Center - Kefeta,https://kefeta.et/youthhubs/nifas-silk-lafto-youth-center/,"Nifas Silk Lafto Youth Center · kera around sofia Mall Addis Ababa 1, Addis Ababa Ethiopia · Phone: +251955340166 · Mekelle: Kefeta Fully Operational, Delivering its Integrated Services · 20 Youth Coalitions will be Supported to Implement Social Grant Projects ·",Supermarket,Nifas Silk Lafto,,+251955340166,,https://www.google.com/maps/search/?api=1&query=Nifas+Silk+Lafto+Youth+Center+-+Kefeta+Nifas+Silk+Lafto+Addis+Ababa+Ethiopia,https://courses.kefeta.et/ | https://ewket.amref.org | https://kefeta.et/ | https://kefeta.et/blogs/2024/04/08/20-youth-coalitions-will-be-supported-to-implement-social-grant-projects/ | https://kefeta.et/blogs/2024/04/08/kefeta-celebrated-internationalwomens-day-2024-calling-forequitable-and-meaningful-investmentin-young-womens-education-healthand-socio-economic-advancement/ | https://kefeta.et/blogs/2024/04/08/mekelle-kefeta-fully-operational-delivering-its-integrated-services/ | https://kefeta.et/blogs/2024/04/08/parental-engagement-workshop-conducted/ | https://kefeta.et/blogs/2024/04/08/training-to-ensure-quality-businessdevelopment-support-for-youth/ | https://kefeta.et/category/amharic/events/ | https://kefeta.et/category/amharic/news-amharic/,2026-05-10T12:35:12.758176+00:00
"Nifas Silk-Lafto, Ethiopia",https://www.mindat.org/feature-8643575.html,Mindat.org is the world&#x27;s leading website about minerals and where they come from.,Supermarket,Nifas Silk Lafto,,,,https://www.google.com/maps/search/?api=1&query=Nifas+Silk-Lafto%2C+Ethiopia+Nifas+Silk+Lafto+Addis+Ababa+Ethiopia,http://www.geonames.org | https://creativecommons.org/licenses/by/4.0/ | https://doi.org/10.2138/am-2024-9486 | https://www.mindat.org/ | https://www.mindat.org/a/about | https://www.mindat.org/a/bugs | https://www.mindat.org/a/chinese_newsletter | https://www.mindat.org/a/common_minerals | https://www.mindat.org/a/corporate_sponsorship | https://www.mindat.org/a/educators,2026-05-10T12:35:12.758176+00:00
Addis Ababa Ketema v Nifas Silk Lafto SC,https://www.plus.fifa.com/en/content/addis-ababa-ketema-vs-nifas-silk-lafto-sc/bc1c0c13-66b0-4311-9174-920ed95f84e7?gl=us,We cannot provide a description for this page right now,Supermarket,Nifas Silk Lafto,,,,https://www.google.com/maps/search/?api=1&query=Addis+Ababa+Ketema+v+Nifas+Silk+Lafto+SC+Nifas+Silk+Lafto+Addis+Ababa+Ethiopia,,2026-05-10T12:35:15.435400+00:00
"Offices, Stores, Warehouses & Others for Sale in Nifas Silk-Lafto, Addis Ababa | Ethiopia Property Centre",https://ethiopiapropertycentre.com/for-sale/commercial/addis-ababa/nifas-silk-lafto/showtype,"List of Offices, Shops, Hotels, Warehouses, Filling Stations &amp; Other Commercial Property for Sale in Nifas Silk-Lafto, Addis Ababa ()",Supermarket,Nifas Silk Lafto,,,,https://www.google.com/maps/search/?api=1&query=Offices%2C+Stores%2C+Warehouses+%26+Others+for+Sale+in+Nifas+Silk-Lafto%2C+Addis+Ababa+%7C+Ethiopia+Property+Centre+Nifas+Silk+Lafto+Addis+Ababa+Ethiopia,https://facebook.com/share.php?u=https%3A%2F%2Fethiopiapropertycentre.com%2Ffor-sale%2Fcommercial%2Faddis-ababa%2Fnifas-silk-lafto%2Fshowtype%3Futm_source%3Dfacebook%26utm_medium%3Dsharing%26utm_campaign%3DSocial%2BButtons | https://twitter.com/ETPropertyCntr | https://twitter.com/intent/tweet?text=Offices%2C+Stores%2C+Warehouses+%26+Others+for+Sale+in+Nifas+Silk-Lafto%2C+Addis+Ababa+%2814+available%29+%7C+Ethiopia+Property+Centre&url=https%3A%2F%2Fethiopiapropertycentre.com%2Ffor-sale%2Fcommercial%2Faddis-ababa%2Fnifas-silk-lafto%2Fshowtype%3Futm_source%3Dtwitter%26utm_medium%3Dsharing%26utm_campaign%3DSocial%2BButtons | https://www.facebook.com/EthiopiaPropertyCentre | https://www.linkedin.com/company/ethiopia-property-centre,2026-05-10T12:35:15.435400+00:00
"11 Best Hotels in Nefassilk Lafto, Addis Ababa",https://www.agoda.com/nefassilk-lafto/maps/addis-ababa-et.html,We cannot provide a description for this page right now,Supermarket,Nifas Silk Lafto,,,,https://www.google.com/maps/search/?api=1&query=11+Best+Hotels+in+Nefassilk+Lafto%2C+Addis+Ababa+Nifas+Silk+Lafto+Addis+Ababa+Ethiopia,,2026-05-10T12:35:15.435400+00:00
2023 Exciting NEFAS SILK SUB CITY | Project,https://besystechnologies.com/nefas-silk-sub-city/,"Nefas Silk Sub City involved the supply, design, installation, implementation, commissioning, and support of several key systems for ....",Supermarket,Nifas Silk Lafto,,,,https://www.google.com/maps/search/?api=1&query=2023+Exciting+NEFAS+SILK+SUB+CITY+%7C+Project+Nifas+Silk+Lafto+Addis+Ababa+Ethiopia,https://www.facebook.com/profile.php?id=61555126808510 | https://www.instagram.com/besys_technologies_plc/ | https://www.linkedin.com/company/98585457/admin/feed/posts/,2026-05-10T12:35:15.435400+00:00
Region 1: Addis Ababa | Ethiopia Postcode ✉️,https://eth.postcodebase.com/taxonomy/term/1,This is the Addis Ababa page list. You can click the title to browse the detail information.,Supermarket,Nifas Silk Lafto,,,,https://www.google.com/maps/search/?api=1&query=Region+1%3A+Addis+Ababa+%7C+Ethiopia+Postcode+%E2%9C%89%EF%B8%8F+Nifas+Silk+Lafto+Addis+Ababa+Ethiopia,http://eth.youbianku.com/ | https://eth.postcodebase.com/ | https://eth.postcodebase.com/contact | https://eth.postcodebase.com/node/1 | https://eth.postcodebase.com/node/10 | https://eth.postcodebase.com/node/2 | https://eth.postcodebase.com/node/3 | https://eth.postcodebase.com/node/4 | https://eth.postcodebase.com/node/5 | https://eth.postcodebase.com/node/6,2026-05-10T12:35:15.435400+00:00
"FHAM: Natural mineral water, Head Office o Addis Ababa, Ethiopia o Nifas Silk Lafto Sub City Woreda 03 o Bisr, Addis Ababa (2022)",https://www.foodbevg.com/ET/Addis-Ababa/109356484884361/FHAM:-Natural-mineral-water,"Head Office o Addis Ababa, Ethiopia o Nifas Silk Lafto Sub City Woreda 03 o Bisrate Gabriel Area, in front of Queen’s Supermarket, Bayne Building 3rd Floor, No.",Supermarket,Nifas Silk Lafto,,,,https://www.google.com/maps/search/?api=1&query=FHAM%3A+Natural+mineral+water%2C+Head+Office+o+Addis+Ababa%2C+Ethiopia+o+Nifas+Silk+Lafto+Sub+City+Woreda+03+o+Bisr%2C+Addis+Ababa+%282022%29+Nifas+Silk+Lafto+Addis+Ababa+Ethiopia,https://twitter.com/intent/tweet?url=# | https://www.facebook.com/sharer/sharer.php?u=# | https://www.linkedin.com/shareArticle?url=#,2026-05-10T12:35:15.435400+00:00
"Holiday Hotel 4* rates from $36 ➜ Nifas Silk-Lafto, Addis Ababa",https://www.readytotrip.com/hotels/Ethiopia/Addis%20Ababa/Nifas%20Silk-Lafto/holiday-addis-ababa/,"Book affordable rooms at Holiday Hotel 4* - 2026 year prices with photos and reviews. Comfortable Accommodation: Holiday Hotel Addis Ababa in Addis Ababa offers family rooms with balconies, private bathrooms, and",Supermarket,Nifas Silk Lafto,,,,https://www.google.com/maps/search/?api=1&query=Holiday+Hotel+4%2A+rates+from+%2436+%E2%9E%9C+Nifas+Silk-Lafto%2C+Addis+Ababa+Nifas+Silk+Lafto+Addis+Ababa+Ethiopia,,2026-05-10T12:35:15.435400+00:00
"Nifas silk lafto Sub City Wereda 01 Administrative Office (Administrative Office) (Addis Ababa, Ethiopia)",https://www.addismap.com/a201768509/nifas-silk-lafto-sub-city-wereda-01-administrative-office,"Take AddisMap with you - GARMIN ... map of Ethiopia · Target your future customers on AddisMap Get offer now Lead new customers to you now. Reserve hotel a hotel room online on AddisMap. List of hotels Hassle free - online booking in any hotel · Nifas silk lafto Sub City Wereda 01 Administrative Office (Administrative Office) Addis Ababa, ...",Supermarket,Nifas Silk Lafto,,,,https://www.google.com/maps/search/?api=1&query=Nifas+silk+lafto+Sub+City+Wereda+01+Administrative+Office+%28Administrative+Office%29+%28Addis+Ababa%2C+Ethiopia%29+Nifas+Silk+Lafto+Addis+Ababa+Ethiopia,http://www.addismap.com/ | http://www.addismap.com/#16/8.9461288664457/38.7227446051637 | https://www.addismap.com/#advertiseModal | https://www.addismap.com/am/a201768509/nifas-silk-lafto-sub-city-wereda-01-administrative-office | https://www.addismap.com/downloads | https://www.addismap.com/hotels | https://www.addismap.com/p-240690/asrat-sook | https://www.addismap.com/p-269672/hakime-sook | https://www.addismap.com/p-278674/hamid-sook | https://www.addismap.com/p-281708/sefa-sook,2026-05-10T12:35:15.435400+00:00
Nifas Silk Lafto SC v Addis Ketema SC,https://www.plus.fifa.com/en/content/nifas-silk-lafto-sc-vs-addis-ketema-sc/47fd8c43-1654-4132-af4a-78149e3e22cf?gl=us,We cannot provide a description for this page right now,Supermarket,Nifas Silk Lafto,,,,https://www.google.com/maps/search/?api=1&query=Nifas+Silk+Lafto+SC+v+Addis+Ketema+SC+Nifas+Silk+Lafto+Addis+Ababa+Ethiopia,,2026-05-10T12:35:15.435911+00:00
"Nifas silk lafto Sub City Wereda 09 Administrative Office (Administrative Office) (Addis Ababa, Ethiopia)",https://www.addismap.com/a201764010/nifas-silk-lafto-sub-city-wereda-09-administrative-office,"Take AddisMap with you - GARMIN ... map of Ethiopia · Target your future customers on AddisMap Get offer now Lead new customers to you now. Reserve hotel a hotel room online on AddisMap. List of hotels Hassle free - online booking in any hotel · Nifas silk lafto Sub City Wereda 09 Administrative Office (Administrative Office) Addis Ababa, ...",Supermarket,Nifas Silk Lafto,,,,https://www.google.com/maps/search/?api=1&query=Nifas+silk+lafto+Sub+City+Wereda+09+Administrative+Office+%28Administrative+Office%29+%28Addis+Ababa%2C+Ethiopia%29+Nifas+Silk+Lafto+Addis+Ababa+Ethiopia,http://www.addismap.com/ | http://www.addismap.com/#16/8.95787786741943/38.7719492211933 | https://www.addismap.com/#advertiseModal | https://www.addismap.com/am/a201764010/nifas-silk-lafto-sub-city-wereda-09-administrative-office | https://www.addismap.com/downloads | https://www.addismap.com/hotels | https://www.addismap.com/p-231018/zeritu-sook | https://www.addismap.com/p-248278/azab-sook | https://www.addismap.com/p-251904/biruk-sook | https://www.addismap.com/p-254742/genet-juice-bet,2026-05-10T12:35:15.435911+00:00
"Nifas Silk Lafto - Alchetron, The Free Social Encyclopedia",https://alchetron.com/Nifas-Silk-Lafto,"Nifas SilkLafto, also spelled Niffassilk Lafto or Nefassilk Lafto, is one of the 10 subcities of Addis Ababa, the capital of Ethiopia. As of 2011 its population was of 335,740. The district is located in the southwestern suburb of the city. It borders with the districts of Kolfe Keranio, Lideta, Ki",Supermarket,Nifas Silk Lafto,,,,https://www.google.com/maps/search/?api=1&query=Nifas+Silk+Lafto+-+Alchetron%2C+The+Free+Social+Encyclopedia+Nifas+Silk+Lafto+Addis+Ababa+Ethiopia,https://alchetron.com/ | https://alchetron.com/Addis-Ababa | https://alchetron.com/Caro-Ramsay | https://alchetron.com/East-Africa-Time | https://alchetron.com/Ethiopia | https://alchetron.com/Jürgen-W.-Gansel | https://alchetron.com/Kirkos | https://alchetron.com/Kolfe-Keranio | https://alchetron.com/Lideta | https://alchetron.com/Nifas-Silk-Lafto#Geography,2026-05-10T12:35:15.435911+00:00
"Nifas silk lafto Sub City Wereda 06 Administrative Office Map - Addis Ababa, Ethiopia",https://mapcarta.com/W201764008,"Nifas silk lafto Sub City Wereda 06 Administrative Office is a government office in Addis Ababa, Central Ethiopia. Mapcarta, the open map.",Supermarket,Nifas Silk Lafto,,,,https://www.google.com/maps/search/?api=1&query=Nifas+silk+lafto+Sub+City+Wereda+06+Administrative+Office+Map+-+Addis+Ababa%2C+Ethiopia+Nifas+Silk+Lafto+Addis+Ababa+Ethiopia,https://artlibre.org/licence/lal/en/ | https://cnes.fr | https://commons.wikimedia.org/wiki/File:Addis_Ababa_banner_Churchill_Avenue.jpg | https://commons.wikimedia.org/wiki/File:ET_Addis_asv2018-01_img01_Meskel_Square.jpg | https://commons.wikimedia.org/wiki/File:ET_Addis_asv2018-01_img02_Stadium.jpg | https://commons.wikimedia.org/wiki/File:ET_Addis_asv2018-02_img7.jpg | https://commons.wikimedia.org/wiki/Main_Page | https://creativecommons.org/licenses/by-sa/3.0/deed.en | https://creativecommons.org/licenses/by-sa/4.0/ | https://en.wikipedia.org/wiki/Building,2026-05-10T12:35:15.435911+00:00
"Sunrise Sunset Times of Nifas Silk Lafto Sub City Government Office, Addis Ababa, Ethiopia - MAPLOGS",https://sunrise.maplogs.com/nifas_silk_lafto_sub_city_government_office_addis_ababa_ethiopia.404020.html,"The sunrise time and sunset time in Nifas Silk Lafto Sub City Government Office, Addis Ababa, Ethiopia, including beautiful sunrise or sunset photos, local current time, timezone, longitude, latitude and Google Map.",Supermarket,Nifas Silk Lafto,,,,https://www.google.com/maps/search/?api=1&query=Sunrise+Sunset+Times+of+Nifas+Silk+Lafto+Sub+City+Government+Office%2C+Addis+Ababa%2C+Ethiopia+-+MAPLOGS+Nifas+Silk+Lafto+Addis+Ababa+Ethiopia,https://elevation.maplogs.com | https://maplogs.com | https://sunrise.maplogs.com | https://sunrise.maplogs.com/ | https://sunrise.maplogs.com/42a_simla_crescent_khandallah_wellington_city_wellington_region_new_zealand.519477.html | https://sunrise.maplogs.com/addis_ababa_airport_bole_addis_ababa_ethiopia.227754.html | https://sunrise.maplogs.com/addis_ababa_ethiopia.152663.html | https://sunrise.maplogs.com/addis_ababa_ethiopia.152664.html | https://sunrise.maplogs.com/addis_ababa_science_and_technology_university_addis_ababa_ethiopia.465219.html | https://sunrise.maplogs.com/addis_ababa_science_and_technology_university_gofa_mazoria_to_mebrathail_kera_nefas_silk_addis_ababa_ethiopia.512051.html,2026-05-10T12:35:15.435911+00:00
Nefas Silk Lafto Sub City Map - Locality - Ethiopia,https://mapcarta.com/34825062,"Nefas Silk Lafto Sub City is a locality in Ethiopia and has an elevation of 2,224 metres. Mapcarta, the open map.",Supermarket,Nifas Silk Lafto,,,,https://www.google.com/maps/search/?api=1&query=Nefas+Silk+Lafto+Sub+City+Map+-+Locality+-+Ethiopia+Nifas+Silk+Lafto+Addis+Ababa+Ethiopia,https://cnes.fr | https://commons.wikimedia.org/wiki/File:Addis_Ababa_banner_Churchill_Avenue.jpg | https://commons.wikimedia.org/wiki/File:Lalibela_Banner.jpg | https://commons.wikimedia.org/wiki/File:Reppie_Waste-to-Energy_Facility.jpg | https://commons.wikimedia.org/wiki/Main_Page | https://creativecommons.org/licenses/by-sa/3.0/deed.en | https://creativecommons.org/licenses/by-sa/4.0/ | https://creativecommons.org/licenses/by-sa/4.0/deed.en | https://mapcarta.com/ | https://mapcarta.com/13007670,2026-05-10T12:35:18.116009+00:00
"Debre Zeit Road, Nefas Silk",https://ethiopia-streets.openalfa.com/streets/debre-zeit-road-addis-ababa-ethiopia,"Map of Debre Zeit Road, Nefas Silk. Directory of services close to Debre Zeit Road: shops, restaurants, leisure and sports facilities, hospitals, gas stations and other places of interest.",Supermarket,Nifas Silk Lafto,map as well as a list of places and services available aroun,+251911196651,,https://www.google.com/maps/search/?api=1&query=Debre+Zeit+Road%2C+Nefas+Silk+Nifas+Silk+Lafto+Addis+Ababa+Ethiopia,http://www.openstreetmap.org/copyright | https://ethiopia-streets.openalfa.com/ | https://ethiopia-streets.openalfa.com/addis-ababa | https://ethiopia-streets.openalfa.com/cities | https://ethiopia-streets.openalfa.com/contact-us | https://ethiopia-streets.openalfa.com/my-location | https://ethiopia-streets.openalfa.com/nefas-silk | https://ethiopia-streets.openalfa.com/privacy-policy | https://ethiopia-streets.openalfa.com/roads | https://ethiopia-streets.openalfa.com/streets/debre-zeit-road-gotera-addis-ababa,2026-05-10T12:35:18.116009+00:00
"Visit Nifas Silk-Lafto: Best of Nifas Silk-Lafto, Addis Ababa Travel 2025 | Expedia Tourism",https://www.expedia.ca/Addis-Ababa-Nifas-Silk-Lafto.dx553248633981729591,"Explore the best of Nifas Silk-Lafto! Whether you want to experience the city like a tourist or follow the locals, check out this great resource for your trip.",Supermarket,Nifas Silk Lafto,,,,https://www.google.com/maps/search/?api=1&query=Visit+Nifas+Silk-Lafto%3A+Best+of+Nifas+Silk-Lafto%2C+Addis+Ababa+Travel+2025+%7C+Expedia+Tourism+Nifas+Silk+Lafto+Addis+Ababa+Ethiopia,,2026-05-10T12:35:18.116512+00:00
Food Distributors in Ethiopia,https://www.food1.com/food-distributors/ethiopia,"Nifas Silk Lafto Sub city, Woreda 11, H.No: 506 · Addis Ababa, 474, 1110",Supermarket,Nifas Silk Lafto,,,,https://www.google.com/maps/search/?api=1&query=Food+Distributors+in+Ethiopia+Nifas+Silk+Lafto+Addis+Ababa+Ethiopia,,2026-05-10T12:35:18.116512+00:00
"(PDF) Challenges of Street Vending Market in Urbanization from Gender Perspective: The Case of Nifas Silk Lafto Sub City, Jemo-01 Area, Addis Ababa, Ethiopia",https://www.researchgate.net/publication/384442474_Challenges_of_Street_Vending_Market_in_Urbanization_from_Gender_Perspective_The_Case_of_Nifas_Silk_Lafto_Sub_City_Jemo-01_Area_Addis_Ababa_Ethiopia,"Management office, Law/Rule enforcement office of Nifas · silk Lafto sub city and Administration, Peace and security who · helped me by filling the questionnaires and participated in the · interview. Last but not least, I would like to thank my families, my mother Birekti Birhane Berhae, brothers and sisters for · their encouragement and support, especially Mr. BirhanuGi- ... The author declares no conflicts of interest. ... Addis Ababa ...",Supermarket,Nifas Silk Lafto,,,,https://www.google.com/maps/search/?api=1&query=%28PDF%29+Challenges+of+Street+Vending+Market+in+Urbanization+from+Gender+Perspective%3A+The+Case+of+Nifas+Silk+Lafto+Sub+City%2C+Jemo-01+Area%2C+Addis+Ababa%2C+Ethiopia+Nifas+Silk+Lafto+Addis+Ababa+Ethiopia,,2026-05-10T12:35:18.116512+00:00
"Nifas silk lafto Sub City Wereda 01 Administrative Office Map - Addis Ababa, Ethiopia",https://mapcarta.com/W201768509,"Nifas silk lafto Sub City Wereda 01 Administrative Office is a building in Addis Ababa, Central Ethiopia. Mapcarta, the open map.",Supermarket,Nifas Silk Lafto,,,,https://www.google.com/maps/search/?api=1&query=Nifas+silk+lafto+Sub+City+Wereda+01+Administrative+Office+Map+-+Addis+Ababa%2C+Ethiopia+Nifas+Silk+Lafto+Addis+Ababa+Ethiopia,https://cnes.fr | https://commons.wikimedia.org/wiki/File:Addis_Ababa_banner_Churchill_Avenue.jpg | https://commons.wikimedia.org/wiki/File:Reppie_Waste-to-Energy_Facility.jpg | https://commons.wikimedia.org/wiki/Main_Page | https://creativecommons.org/licenses/by-sa/3.0/deed.en | https://creativecommons.org/licenses/by-sa/4.0/ | https://creativecommons.org/licenses/by-sa/4.0/deed.en | https://en.wikipedia.org/wiki/Building | https://en.wikipedia.org/wiki/Office | https://mapcarta.com/,2026-05-10T12:35:18.116512+00:00
"Nifas silk lafto Sub City Wereda 11 Administrative Office (Building) (Addis Ababa, Ethiopia)",https://www.addismap.com/a201764013/nifas-silk-lafto-sub-city-wereda-11-administrative-office,"Take AddisMap with you - GARMIN ... map of Ethiopia · Target your future customers on AddisMap Get offer now Lead new customers to you now. Reserve hotel a hotel room online on AddisMap. List of hotels Hassle free - online booking in any hotel · Nifas silk lafto Sub City Wereda 11 Administrative Office (Building) Addis Ababa, ...",Supermarket,Nifas Silk Lafto,,,,https://www.google.com/maps/search/?api=1&query=Nifas+silk+lafto+Sub+City+Wereda+11+Administrative+Office+%28Building%29+%28Addis+Ababa%2C+Ethiopia%29+Nifas+Silk+Lafto+Addis+Ababa+Ethiopia,http://www.addismap.com/ | http://www.addismap.com/#16/8.93617372281956/38.7458275835189 | https://www.addismap.com/#advertiseModal | https://www.addismap.com/am/a201764013/nifas-silk-lafto-sub-city-wereda-11-administrative-office | https://www.addismap.com/downloads | https://www.addismap.com/hotels | https://www.addismap.com/p-230204/negash-hotel | https://www.addismap.com/p-243776/obama-juice | https://www.addismap.com/p-244406/tekeze-hotel | https://www.addismap.com/p-247106/geni-caf%C3%A9,2026-05-10T12:35:18.116512+00:00
