name,url,description,category,neighborhood,address,phone,rating,google_maps_url,links_on_site,scraped_at
Lideta Mercato: Contemporary Market in Ethiopia by Vilalta - Arch2O.com,https://www.arch2o.com/lideta-mercato-contemporary-market-ethiopia-vilalta/,"Lideta Mercato: Contemporary Market in Ethiopia by Vilalta The Lideta Mercato is a new non-typical shopping mall in the Ethiopian capital, Addis Ababa.",Supermarket,Lideta,,,,https://www.google.com/maps/search/?api=1&query=Lideta+Mercato%3A+Contemporary+Market+in+Ethiopia+by+Vilalta+-+Arch2O.com+Lideta+Addis+Ababa+Ethiopia,https://www.arch2o.com | https://www.arch2o.com/about/ | https://www.arch2o.com/author/yosra-m-ahmed/ | https://www.arch2o.com/category/architecture/ | https://www.arch2o.com/category/architecture/adaptive-reuse/ | https://www.arch2o.com/category/architecture/commercial-buildings/ | https://www.arch2o.com/category/architecture/commercial-buildings/malls/ | https://www.arch2o.com/category/architecture/commercial-buildings/market/ | https://www.arch2o.com/category/architecture/commercial-buildings/shopping-stores/ | https://www.arch2o.com/category/architecture/cultural-buildings/,2026-05-10T12:34:24.756563+00:00
"Commercial premises in Lideta, Addis Ababa",https://ethiopia-streets.openalfa.com/lideta/shopping,"e.g. Uganda Street, Lideta, BL_03_713 St., Bole, Addis AbabaHome » Addis Ababa » Lideta » Shopping ... Abrose Bekery Dej. Mekonin Demisaw ... Muke barbery Dej. Mekonin Demisaw ... - ሁለተኛ በረ Addis Ababa Phone: +251 966911444 Email: hiwotabeje002@gmail.com Opening hours: 24/7 · joshanson ltd Bekele Weya Street Opening hours: 24/7 ... KTM Ethiopia Sudan Street Phone: +251 92 212 2921 Email: info@africaridingadventures.com Provide tours in Ethiopia mainly during the dry season (mid-September to mid-June), Independent Travellers Support, mechanical support",Supermarket,Lideta,,+251 966911444,,https://www.google.com/maps/search/?api=1&query=Commercial+premises+in+Lideta%2C+Addis+Ababa+Lideta+Addis+Ababa+Ethiopia,http://www.globalAUto.com | http://www.openstreetmap.org/copyright | https://ethiopia-streets.openalfa.com/ | https://ethiopia-streets.openalfa.com/addis-ababa | https://ethiopia-streets.openalfa.com/cities | https://ethiopia-streets.openalfa.com/contact-us | https://ethiopia-streets.openalfa.com/lideta | https://ethiopia-streets.openalfa.com/lideta/accommodation | https://ethiopia-streets.openalfa.com/lideta/banks | https://ethiopia-streets.openalfa.com/lideta/car-services,2026-05-10T12:34:24.756563+00:00
cover story Lideta Mercato; Voted worlds best shopping centre - Issuu,https://issuu.com/constructionreviewafrica/docs/cr_may-june_2020/s/10664704,"The Lideta Mercato is a new non-typical shopping mall in the Ethiopian capital, Addis Ababa.",Supermarket,Lideta,,,,https://www.google.com/maps/search/?api=1&query=cover+story+Lideta+Mercato%3B+Voted+worlds+best+shopping+centre+-+Issuu+Lideta+Addis+Ababa+Ethiopia,https://instagram.com/issuu | https://twitter.com/issuu | https://www.facebook.com/issuu | https://www.linkedin.com/company/issuu,2026-05-10T12:34:24.757143+00:00
Lideta Mercato | Vilalta Architects,https://www.archilovers.com/projects/214637/lideta-mercato.html,"El proyecto más importante de Xavier Vilalta en Etiopía, el Lideta Mercato, acaba de terminar su construcción y abrirá finalmente sus puertas al público de Addis Abeba este verano.",Supermarket,Lideta,,,,https://www.google.com/maps/search/?api=1&query=Lideta+Mercato+%7C+Vilalta+Architects+Lideta+Addis+Ababa+Ethiopia,https://instagram.com/archilovers | https://instagram.com/archilovers/ | https://twitter.com/ArchiloversCom | https://www.facebook.com/archilovers,2026-05-10T12:34:24.757143+00:00
Lideta Market (Lideta Mercato),https://www.tripbucket.com/dreams/dream/see-lideta-market-lideta-mercato-addis-ababa-ethiopia/,{{ vm.pageDescription }},Supermarket,Lideta,,,,https://www.google.com/maps/search/?api=1&query=Lideta+Market+%28Lideta+Mercato%29+Lideta+Addis+Ababa+Ethiopia,,2026-05-10T12:34:24.757143+00:00
"Lideta Mercato, Addis Ababa - Xavier Vilalta | Arquitectura Viva",https://arquitecturaviva.com/works/lideta-mercato-adis-abeba,"Externally the building is clad ... Ethiopian fractal pattern commonly found in local fabrics. This skin gives the building a hermetic image, but also serves as a simple yet effective solar filter, controlling natural light and ventilation in the interior spaces... [+] ... Obra Work Lideta Mercato, Adís Abeba (Etiopía) Addis Ababa ...",Supermarket,Lideta,,,,https://www.google.com/maps/search/?api=1&query=Lideta+Mercato%2C+Addis+Ababa+-+Xavier+Vilalta+%7C+Arquitectura+Viva+Lideta+Addis+Ababa+Ethiopia,https://twitter.com/arquitect_viva | https://www.facebook.com/Arquitectura-Viva-106903759363250/ | https://www.instagram.com/arquitecturaviva_/ | https://www.linkedin.com/company/arquitectura-viva,2026-05-10T12:34:27.440417+00:00
Lideta Mercato by Vilalta Studio - Architizer,https://architizer.com/projects/lideta-market/,"The Lideta Mercato was intended to be a shopping mall just like many others in the city of Addis Ababa. A rigorous analysis has identified the main issues of the existing malls in the city, which are commonly built using glazing structures. As a result, the buildings suffer uncomfortable thermal ...",Supermarket,Lideta,,,,https://www.google.com/maps/search/?api=1&query=Lideta+Mercato+by+Vilalta+Studio+-+Architizer+Lideta+Addis+Ababa+Ethiopia,https://instagram.com/architizer/?utm_source=architizer | https://twitter.com/Architizer?utm_source=architizer | https://www.facebook.com/Architizer?utm_source=architizer,2026-05-10T12:34:27.440417+00:00
LIDETA MERCATO | Vilalta Studio | Archello,https://archello.com/project/lideta-mercato,"The Lideta Mercato was supposed to be a shopping mall like many in the city of Addis Ababa. After analyzing the existing ones we realized that they have 3 weak points: they are empty because the shops are too big, their glass facades create heating and bring too much light in the inside and their image does not reflect Africa, neither Ethiopia...",Supermarket,Lideta,,,,https://www.google.com/maps/search/?api=1&query=LIDETA+MERCATO+%7C+Vilalta+Studio+%7C+Archello+Lideta+Addis+Ababa+Ethiopia,https://twitter.com/Archello | https://www.facebook.com/archellocom | https://www.instagram.com/archello/ | https://www.linkedin.com/company/archello-com/,2026-05-10T12:34:27.440417+00:00
Addis Ababa Coolest Mall Market In Africa Ethiopia - YouTube,https://www.youtube.com/watch?v=q8_-Y4ESTPQ,"Addis Ababa Coolest Mall Market In Africa EthiopiaDiscover the fascinating story behind Lideta Market Mall in Addis Ababa Ethiopia, East Africa—a building th...",Supermarket,Lideta,,,,https://www.google.com/maps/search/?api=1&query=Addis+Ababa+Coolest+Mall+Market+In+Africa+Ethiopia+-+YouTube+Lideta+Addis+Ababa+Ethiopia,https://developers.google.com/youtube | https://www.youtube.com/ | https://www.youtube.com/about/ | https://www.youtube.com/about/copyright/ | https://www.youtube.com/about/policies/ | https://www.youtube.com/about/press/ | https://www.youtube.com/ads/ | https://www.youtube.com/creators/ | https://www.youtube.com/howyoutubeworks?utm_campaign=ytgen&utm_source=ythp&utm_medium=LeftNav&utm_content=txt&u=https%3A%2F%2Fwww.youtube.com%2Fhowyoutubeworks%3Futm_source%3Dythp%26utm_medium%3DLeftNav%26utm_campaign%3Dytgen | https://www.youtube.com/new,2026-05-10T12:34:30.044099+00:00
"Zambia Street, Lideta",https://ethiopia-streets.openalfa.com/streets/zambia-street-addis-ababa-ethiopia,"Map of Zambia Street, Lideta. Directory of services close to Zambia Street: shops, restaurants, leisure and sports facilities, hospitals, gas stations and other places of interest.",Supermarket,Lideta,map as well as a list of places and services available aroun,+251926378606,,https://www.google.com/maps/search/?api=1&query=Zambia+Street%2C+Lideta+Lideta+Addis+Ababa+Ethiopia,http://www.openstreetmap.org/copyright | https://ethiopia-streets.openalfa.com/ | https://ethiopia-streets.openalfa.com/addis-ababa | https://ethiopia-streets.openalfa.com/cities | https://ethiopia-streets.openalfa.com/contact-us | https://ethiopia-streets.openalfa.com/lideta | https://ethiopia-streets.openalfa.com/my-location | https://ethiopia-streets.openalfa.com/privacy-policy | https://ethiopia-streets.openalfa.com/roads | https://ethiopia-streets.openalfa.com/streets/gl_08_1779-st-kolobo-addis-ababa,2026-05-10T12:34:30.044099+00:00
"LD_02_0212 Street, Coca, Lideta",https://ethiopia-streets.openalfa.com/streets/ld_02_0212-st-coca-addis-ababa,"Map of LD_02_0212 Street, Coca, Lideta. Directory of services close to LD_02_0212 Street, Coca: shops, restaurants, leisure and sports facilities, hospitals, gas stations and other places of interest.",Supermarket,Lideta,map as well as a list of places and services available aroun,,,https://www.google.com/maps/search/?api=1&query=LD_02_0212+Street%2C+Coca%2C+Lideta+Lideta+Addis+Ababa+Ethiopia,http://www.openstreetmap.org/copyright | https://ethiopia-streets.openalfa.com/ | https://ethiopia-streets.openalfa.com/addis-ababa | https://ethiopia-streets.openalfa.com/cities | https://ethiopia-streets.openalfa.com/coca | https://ethiopia-streets.openalfa.com/contact-us | https://ethiopia-streets.openalfa.com/lideta | https://ethiopia-streets.openalfa.com/my-location | https://ethiopia-streets.openalfa.com/privacy-policy | https://ethiopia-streets.openalfa.com/roads,2026-05-10T12:34:30.044099+00:00
Introducing our African Architecture spotlight: The Lideta Mercato - Bright Guide Africa,https://brightguideafrica.com/introducing-our-african-architecture-spotlight-the-lideta-mercato/,"The series explores how different built environments interact with their local contexts, shining a light on a range of aesthetics.",Supermarket,Lideta,,,,https://www.google.com/maps/search/?api=1&query=Introducing+our+African+Architecture+spotlight%3A+The+Lideta+Mercato+-+Bright+Guide+Africa+Lideta+Addis+Ababa+Ethiopia,,2026-05-10T12:34:30.044099+00:00
Map of Lideta Sub-city in Addis Ababa | Download Scientific Diagram,https://www.researchgate.net/figure/Map-of-Lideta-Sub-city-in-Addis-Ababa_fig1_365201121,"Food safety, hygiene and sanitation status of micro and small food service enterprises: the case of Lideta sub-city, Addis Ababa. Ethiopian Journal of Development Research.",Supermarket,Lideta,,,,https://www.google.com/maps/search/?api=1&query=Map+of+Lideta+Sub-city+in+Addis+Ababa+%7C+Download+Scientific+Diagram+Lideta+Addis+Ababa+Ethiopia,,2026-05-10T12:34:32.634472+00:00
VILALTA completes mall in ethiopia with perforated envelope,https://www.designboom.com/architecture/vilalta-arquitectura-lideta-mercato-shopping-mall-addis-ababa-ethiopia-12-26-2016/,the building in addis ababa draws cues from african open-air markets and the façade reference traditional ethiopian fractal patterns found in local fabrics.,Supermarket,Lideta,addis ababa,,,https://www.google.com/maps/search/?api=1&query=VILALTA+completes+mall+in+ethiopia+with+perforated+envelope+Lideta+Addis+Ababa+Ethiopia,https://twitter.com/intent/tweet?url=https%3A%2F%2Fwww.designboom.com%2Farchitecture%2Fvilalta-arquitectura-lideta-mercato-shopping-mall-addis-ababa-ethiopia-12-26-2016%2F%3Fd%3Db&text=VILALTA%20completes%20mall%20in%20ethiopia%20with%20perforated%20envelope&via=designboom | https://www.facebook.com/designboomnews/ | https://www.facebook.com/sharer.php?u=https%3A%2F%2Fwww.designboom.com%2Farchitecture%2Fvilalta-arquitectura-lideta-mercato-shopping-mall-addis-ababa-ethiopia-12-26-2016%2F&t=VILALTA%2520completes%2520mall%2520in%2520ethiopia%2520with%2520perforated%2520envelope | https://www.instagram.com/designboom.shop/ | https://www.instagram.com/designboom/ | https://www.instagram.com/milan.design.week/ | https://www.instagram.com/venice.architecture.biennale/ | https://www.instagram.com/venice.art.biennale/ | https://www.linkedin.com/company/designboom/ | https://www.twitter.com/designboom/,2026-05-10T12:34:32.635488+00:00
"Places in Lideta - Addis Ababa, Ethiopia",https://map.et/lideta,"Lideta - Addis Ababa, Ethiopia · Community Street View Images from Lideta - Addis Ababa, Ethiopia · Jul 2019 by surafel (Mapillary) 📍 3.1km from center ⭐ 4.6 · Aug 2019 by surafel (Mapillary) 📍 2.7km from center ⭐ 4.6 · Jul 2019 by surafel (Mapillary) 📍 2.7km from center ⭐ ...",Supermarket,Lideta,,,,https://www.google.com/maps/search/?api=1&query=Places+in+Lideta+-+Addis+Ababa%2C+Ethiopia+Lideta+Addis+Ababa+Ethiopia,https://map.et/addis-ababa | https://map.et/lideta/airports | https://map.et/lideta/apartments | https://map.et/lideta/areas | https://map.et/lideta/art-centers | https://map.et/lideta/banks | https://map.et/lideta/bars | https://map.et/lideta/beverages-shops | https://map.et/lideta/book-shops | https://map.et/lideta/bowling,2026-05-10T12:34:32.635488+00:00
Food Court in Addis Ababa Lideta,https://www.tiktok.com/discover/food-court-in-addis-ababa-lideta,We cannot provide a description for this page right now,Supermarket,Lideta,,,,https://www.google.com/maps/search/?api=1&query=Food+Court+in+Addis+Ababa+Lideta+Lideta+Addis+Ababa+Ethiopia,,2026-05-10T12:34:32.635488+00:00
"Lideta Mercato, the shopping mall adapted to its environment",https://codinaarchitectural.com/lideta-mercato-the-shopping-mall-adapted-to-its-environment/,"All too often, building construction fails to find a sympathetic balance with its surroundings. This has not been the case with the Lideta Mercato shopping mall in the Ethiopian capital, Addis Ababa, built by XV Studio, the firm of Catalan architect Xavier Vilalta.",Supermarket,Lideta,,,,https://www.google.com/maps/search/?api=1&query=Lideta+Mercato%2C+the+shopping+mall+adapted+to+its+environment+Lideta+Addis+Ababa+Ethiopia,https://es.linkedin.com/company/codinaarchitectural#updates | https://www.facebook.com/codinaarchitectural/?view_public_for=660230960770270 | https://www.instagram.com/codinaarchitectural/ | https://www.linkedin.com/company/codina?trk=recent-update_see-all#updates,2026-05-10T12:34:35.223492+00:00
Lideta Mercato / Vilalta Architects | ArchDaily,https://www.archdaily.com/122599/lideta-mercato-xv-studio,"Vilalta Architects unveils the design of a project of a multistory market, Lideta Mercato, in Ethiopia’s capital city Addis Ababa. This project was...",Supermarket,Lideta,,,,https://www.google.com/maps/search/?api=1&query=Lideta+Mercato+%2F+Vilalta+Architects+%7C+ArchDaily+Lideta+Addis+Ababa+Ethiopia,https://twitter.com/intent/tweet?text=Lideta%20Mercato%20%2F%20Vilalta%20Architects&url=https://www.archdaily.com/122599/lideta-mercato-xv-studio&via=archdaily | https://www.facebook.com/sharer/sharer.php?u=https://www.archdaily.com/122599/lideta-mercato-xv-studio | https://www.linkedin.com/sharing/share-offsite/?url=https%3A%2F%2Fwww.archdaily.com%2F122599%2Flideta-mercato-xv-studio,2026-05-10T12:34:35.223492+00:00
Fresh Ethiopian Food Variety Store | Ledeta Gebeya,https://ledeta.com/,"Discover ledeta gebeya, your go-to store for fresh, dried, and delicious Ethiopian food. Experience the rich flavors of Ethiopia today!",Supermarket,Lideta,,,,https://www.google.com/maps/search/?api=1&query=Fresh+Ethiopian+Food+Variety+Store+%7C+Ledeta+Gebeya+Lideta+Addis+Ababa+Ethiopia,https://ledeta.com/ | https://ledeta.com/amharic | https://ledeta.com/visit,2026-05-10T12:34:35.223492+00:00
Lideta Mercato Market / Vilalta Architects |,https://www.archidatum.com/projects/lideta-mercato-market-vilalta-architects/,Lideta Mercato Market / Vilalta Architects Addis Ababa Architects Architecture in Africa Xavier Vilalta Architects Markets in Africa Shopping Malls in Ethiopia Shopping Malls in Ethiopia Africa,Supermarket,Lideta,Addis Ababa,,,https://www.google.com/maps/search/?api=1&query=Lideta+Mercato+Market+%2F+Vilalta+Architects+%7C+Lideta+Addis+Ababa+Ethiopia,,2026-05-10T12:34:35.223492+00:00
"Street Market At Lideta Stock Photo - Download Image Now - Addis Ababa, Child, Adult - iStock",https://www.istockphoto.com/photo/street-market-at-lideta-gm472191715-36096556,"Addis Ababa,Ethiopia - March 17, 2012 : A view of the people shopping at the street market, with seed and bean sacks in the front, at Lideta District, in Addis Ababa.",Supermarket,Lideta,,,,https://www.google.com/maps/search/?api=1&query=Street+Market+At+Lideta+Stock+Photo+-+Download+Image+Now+-+Addis+Ababa%2C+Child%2C+Adult+-+iStock+Lideta+Addis+Ababa+Ethiopia,https://www.istockphoto.com/ | https://www.istockphoto.com/vector/seamless-feathers-pattern-gm589551276-101275503,2026-05-10T12:34:35.223492+00:00
Lideta Mercato: Contemporary Market in Ethiopia by Vilalta,https://www.pinterest.com/pin/89860955049416779/,"Skip to content · Search for easy dinners, fashion, etc · When autocomplete results are available use up and down arrows to review and enter to select. Touch device users, explore by touch or with swipe gestures · Log in · Sign up · Lideta Mercato: Contemporary Market in Ethiopia by Vilalta ...",Supermarket,Lideta,,,,https://www.google.com/maps/search/?api=1&query=Lideta+Mercato%3A+Contemporary+Market+in+Ethiopia+by+Vilalta+Lideta+Addis+Ababa+Ethiopia,https://www.pinterest.com/ | https://www.pinterest.com/arch2o/ | https://www.pinterest.com/arch2o/interiors/ | https://www.pinterest.com/ideas | https://www.pinterest.com/ideas/addis-ababa-architecture/917869966848/ | https://www.pinterest.com/ideas/central-market-architecture/931124576868/ | https://www.pinterest.com/ideas/ethiopian-architecture-design/959125140587/ | https://www.pinterest.com/ideas/ethiopian-orthodox-church-architecture/918640215270/ | https://www.pinterest.com/ideas/modern-ethiopia/961779278290/ | https://www.pinterest.com/ideas/rock-cut-architecture-ethiopia/951908568458/,2026-05-10T12:34:35.223492+00:00
"Lideta, Addis Ababa, Ethiopia - Reviews, Ratings, Tips and Why You Should Go – Wanderlog",https://wanderlog.com/place/details/9589232/lideta,"Lideta, a vibrant district in Addis Ababa, Ethiopia, is a fascinating blend of the old and the new. With a population of around 214,769 as of 2011, this neighborhood offers solo travelers an enriching experience. Here, modern architecture coexists harmoniously with historical landmarks that ...",Supermarket,Lideta,,,,https://www.google.com/maps/search/?api=1&query=Lideta%2C+Addis+Ababa%2C+Ethiopia+-+Reviews%2C+Ratings%2C+Tips+and+Why+You+Should+Go+%E2%80%93+Wanderlog+Lideta+Addis+Ababa+Ethiopia,https://wanderlog.app.link/?%24canonical_url=https%3A%2F%2Fapp.wanderlog.com%2FdeepLink%2F%3F&%24ios_nativelink=false&%24desktop_url=https%3A%2F%2Fapps.apple.com%2Fus%2Fapp%2Fwanderlog%2Fid1476732439&%24og_image_url=https%3A%2F%2Fwanderlog.com%2Fassets%2Flogo.png | https://wanderlog.app.link/?%24canonical_url=https%3A%2F%2Fapp.wanderlog.com%2FdeepLink%2F%3F&%24ios_nativelink=false&%24desktop_url=https%3A%2F%2Fplay.google.com%2Fstore%2Fapps%2Fdetails%3Fid%3Dcom.wanderlog.android&%24og_image_url=https%3A%2F%2Fwanderlog.com%2Fassets%2Flogo.png | https://wanderlog.app.link/?%24canonical_url=https%3A%2F%2Fapp.wanderlog.com%2FdeepLink%2F%3Futm_medium%3Donsite%26utm_content%3DinOneView%26utm_campaign%3DplacePage&%24ios_nativelink=false&%24ios_url=https%3A%2F%2Fapps.apple.com%2Fapp%2Fapple-store%2Fid1476732439%3Fpt%3D128458617%26ct%3Dc%253AplacePage%252Cct%253AinOneView%252Cm%253Aonsite%26mt%3D8&%24desktop_url=https%3A%2F%2Fapps.apple.com%2Fapp%2Fapple-store%2Fid1476732439%3Fpt%3D128458617%26ct%3Dc%253AplacePage%252Cct%253AinOneView%252Cm%253Aonsite%26mt%3D8&%24og_image_url=https%3A%2F%2Fwanderlog.com%2Fassets%2Flogo.png&~feature=onsite&~campaign=placePage&~tags=inOneView | https://wanderlog.com/ | https://wanderlog.com/blog/ | https://wanderlog.com/blog/jobs/ | https://wanderlog.com/cat | https://wanderlog.com/dmca | https://wanderlog.com/drive | https://wanderlog.com/drive/between/79314/79301/addis-ababa-to-arusha-drive,2026-05-10T12:34:35.223492+00:00
Lideta Market: A Modern Hub in Addis Ababa's Urban Fabric - Oreate AI Blog,https://www.oreateai.com/blog/lideta-market-a-modern-hub-in-addis-ababas-urban-fabric/3d5c56332e1634b298144c11b634bc45,"Addis Ababa, a city constantly evolving, is home to many architectural projects that blend functionality with a sense of place. Among these, the Lideta Market stands out as a significant development, designed by Vilalta Studio. This project, located in the heart of the Ethiopian capital, represents ...",Supermarket,Lideta,,,,https://www.google.com/maps/search/?api=1&query=Lideta+Market%3A+A+Modern+Hub+in+Addis+Ababa%27s+Urban+Fabric+-+Oreate+AI+Blog+Lideta+Addis+Ababa+Ethiopia,,2026-05-10T12:34:35.224500+00:00
Pinterest,https://www.pinterest.com/pin/493636809138822530/,"Skip to content · When autocomplete results are available use up and down arrows to review and enter to select. Touch device users, explore by touch or with swipe gestures · Log in · Sign up",Supermarket,Lideta,,,,https://www.google.com/maps/search/?api=1&query=Pinterest+Lideta+Addis+Ababa+Ethiopia,https://www.pinterest.com/ | https://www.pinterest.com/archdaily/ | https://www.pinterest.com/cwinnike/retail/ | https://www.pinterest.com/ideas | https://www.pinterest.com/ideas/market-building-floor-plan/911970884701/ | https://www.pinterest.com/ideas/market-floor-plan-architecture/933742469527/ | https://www.pinterest.com/ideas/market-floor-plan-design/901537326790/ | https://www.pinterest.com/ideas/market-floor-plan/929794527829/ | https://www.pinterest.com/ideas/market-plan-architecture/940098493959/ | https://www.pinterest.com/ideas/market-plan-design/960398118644/,2026-05-10T12:34:37.907112+00:00
"Examining the Effect of Urban Household Food Insecurity on Fertility in Lideta Sub-City, Addis Ababa, Ethiopia: A Cross-Sectional Study",https://clinmedjournals.org/articles/ijwhw/international-journal-of-womens-health-and-wellness-ijwhw-9-157.php?jid=ijwhw,"Goda ET, Boshera TD, Aredo MK (2023) Examining the Effect of Urban Household Food Insecurity on Fertility in Lideta Sub-City, Addis Ababa, Ethiopia: A Cross-Sectional Study. Int J Womens Health Wellness 9:157.",Supermarket,Lideta,,,,https://www.google.com/maps/search/?api=1&query=Examining+the+Effect+of+Urban+Household+Food+Insecurity+on+Fertility+in+Lideta+Sub-City%2C+Addis+Ababa%2C+Ethiopia%3A+A+Cross-Sectional+Study+Lideta+Addis+Ababa+Ethiopia,,2026-05-10T12:34:37.907112+00:00
"Lideta District Addis Ababa (2025) – Best of TikTok, ...",https://airial.travel/attractions/ethiopia/addis-ababa/lideta-district-addis-ababa-vCqNubRx,"Lideta District: Addis Ababa&#x27;s vibrant culinary heart, famous for authentic shiro, doro wet, and diverse eateries. &quot;A must-visit for food lovers seeking genuine Ethiopian flavors at great prices.&quot;",Supermarket,Lideta,"Lideta few meter away beside belay tekelu cake . Ela review, Addis Ababa",,,https://www.google.com/maps/search/?api=1&query=Lideta+District+Addis+Ababa+%282025%29+%E2%80%93+Best+of+TikTok%2C+...+Lideta+Addis+Ababa+Ethiopia,https://airial.travel/attractions/ethiopia/addis-ababa/addis-ababa-university-main-campus-DdybnYUy | https://airial.travel/attractions/ethiopia/addis-ababa/churchill-avenue-QEVRIxjC | https://airial.travel/attractions/ethiopia/addis-ababa/grand-anwar-mosque-EhMr8XyF | https://airial.travel/attractions/ethiopia/addis-ababa/jan-meda-field-addis-ababa-TK13WN4y | https://airial.travel/attractions/ethiopia/addis-ababa/la-gare-area-z5mBAzNl | https://airial.travel/attractions/ethiopia/addis-ababa/medhane-alem-cathedral-bole-addis-ababa-eUyrTU5l | https://airial.travel/attractions/ethiopia/addis-ababa/mercato-merkato-addis-ababa-MaeyAi-8 | https://airial.travel/attractions/ethiopia/addis-ababa/meskel-square-dZ4VF4Eg | https://airial.travel/attractions/ethiopia/አዲስ-አበባ/mexico-square-e2Fl9VET | https://airial.travel/attractions/ethiopia/አዲስ-አበባ/sheger-park-riverside-JUfDhYSD,2026-05-10T12:34:37.907112+00:00
Best Burger Lideta | TikTok,https://www.tiktok.com/discover/best-burger-lideta,"Discover the best burger spots in Lideta! Try unique Texas-style burgers and more in this vibrant foodie hub.See more videos about Le Meilleur Burger Du Monde, Best Burger at Wendys, Best Burger Pickles, Best Burger in Kl, Best Burger Boulogne, Bester Burger Basel.",Supermarket,Lideta,,,,https://www.google.com/maps/search/?api=1&query=Best+Burger+Lideta+%7C+TikTok+Lideta+Addis+Ababa+Ethiopia,,2026-05-10T12:34:37.908131+00:00
