name,url,description,category,neighborhood,address,phone,rating,google_maps_url,links_on_site,scraped_at
Shoa Hyper Market: A Shopper's Paradise in Addis Ababa,https://evendo.com/locations/ethiopia/shewa/shop/shoa-hyper-market-megenagna,"Experience serenity at Unique Addis Ethio In/Out-Door Massage in Addis Ababa, the perfect retreat for relaxation and rejuvenation during your travels. ... Discover authentic Ethiopian dining at Yimana Kitfo in Bole, Addis Ababa, where the rich flavors and vibrant culture come together in a ...",Supermarket,Bole,,,,https://www.google.com/maps/search/?api=1&query=Shoa+Hyper+Market%3A+A+Shopper%27s+Paradise+in+Addis+Ababa+Bole+Addis+Ababa+Ethiopia,https://www.facebook.com/evendo.global/ | https://www.instagram.com/evendo_events/,2026-05-10T12:33:47.440059+00:00
List Of Grocery stores in Ethiopia,https://rentechdigital.com/smartscraper/business-report-details/list-of-grocery-stores-in-ethiopia,Download the list of Grocery stores in Ethiopia. Smartscrapers provides an accurate directory and the latest data on the number of Grocery stores in Ethiopia,Supermarket,Bole,,,,https://www.google.com/maps/search/?api=1&query=List+Of+Grocery+stores+in+Ethiopia+Bole+Addis+Ababa+Ethiopia,https://twitter.com/DigitalRentech | https://www.facebook.com/RentechDigital/ | https://www.instagram.com/rentechdigital/ | https://www.linkedin.com/company/rentech-digital,2026-05-10T12:33:47.440059+00:00
"Addis Ababa has potential for up to 20 new supermarkets, says research firm",https://www.howwemadeitinafrica.com/addis-ababa-has-potential-for-up-to-20-new-supermarkets-says-research-firm/29689/,Ethiopia&#x27;s retail industry holds considerable potential for growth.,Supermarket,Bole,,,,https://www.google.com/maps/search/?api=1&query=Addis+Ababa+has+potential+for+up+to+20+new+supermarkets%2C+says+research+firm+Bole+Addis+Ababa+Ethiopia,https://www.facebook.com/pages/How-we-made-it-in-Africa/114169345274242 | https://www.linkedin.com/groups/How-we-made-it-in-4962548?home=&gid=4962548&trk=anet_ug_hm | https://www.twitter.com/madeitinafrica,2026-05-10T12:33:47.441064+00:00
"Urban Food Retail in Africa: The case of Addis Ababa, Ethiopia",https://essp.ifpri.info/files/2011/04/ESSP_WP50_UrbanFoodRetail.pdf,"Addis Ababa is especially an interesting case study of urban food retail because of a number of government policies. First, Ethiopia does not allow Foreign Direct Investment (FDI) in food retail and there is thus no presence of multinational · supermarkets that are commonly found in a large ...",Supermarket,Bole,,,,https://www.google.com/maps/search/?api=1&query=Urban+Food+Retail+in+Africa%3A+The+case+of+Addis+Ababa%2C+Ethiopia+Bole+Addis+Ababa+Ethiopia,,2026-05-10T12:33:47.441064+00:00
Ethiopia: Addis Ababa(6),https://www.walmart.com/browse/ethiopia-addis-ababa/c2hlbGZfaWQ6MTczOTI1OAieie,"Shop for Ethiopia: Addis Ababa. Buy products such as Elmer&#x27;s Disappearing Purple School Glue Sticks, Washable, Valentines Day Party Supplies, 2 Sticks at Walmart and save.",Supermarket,Bole,,,,https://www.google.com/maps/search/?api=1&query=Ethiopia%3A+Addis+Ababa%286%29+Bole+Addis+Ababa+Ethiopia,https://corporate.walmart.com/privacy-security | https://help.walmart.com/app/answers/detail/a_id/8 | https://www.walmart.com/ | https://www.walmart.com/account/api/ccpa-intake?native=false&type=access | https://www.walmart.com/account/api/ccpa-intake?native=false&type=sod,2026-05-10T12:33:47.441064+00:00
Addis Ababa Grocery | Authentic Ethiopian Products in the USA,https://addisababagrocery.com/,"Authentic Ethiopian coffee, spices, clothing, and home decor delivered across the USA.",Supermarket,Bole,,,,https://www.google.com/maps/search/?api=1&query=Addis+Ababa+Grocery+%7C+Authentic+Ethiopian+Products+in+the+USA+Bole+Addis+Ababa+Ethiopia,,2026-05-10T12:33:47.441064+00:00
Bole: The Vibrant Heart of Addis Ababa,https://evendo.com/locations/ethiopia/addis-ababa/bole,"Welcome to Bole, the bustling and energetic neighborhood in the heart of Addis Ababa, Ethiopia. As the city&#x27;s primary gateway, Bole is home to Bole International Airport, making it the first stop for many visitors. This vibrant area is known for its lively atmosphere, modern amenities, and ...",Supermarket,Bole,,,,https://www.google.com/maps/search/?api=1&query=Bole%3A+The+Vibrant+Heart+of+Addis+Ababa+Bole+Addis+Ababa+Ethiopia,https://www.facebook.com/evendo.global/ | https://www.instagram.com/evendo_events/,2026-05-10T12:33:47.441064+00:00
TikTok - Make Your Day,https://www.tiktok.com/discover/ethio-supermarket,TikTok Shop is now available on web · Browse your favorite items · TikTok · Log in · Ethio Supermarket,Supermarket,Bole,,,,https://www.google.com/maps/search/?api=1&query=TikTok+-+Make+Your+Day+Bole+Addis+Ababa+Ethiopia,,2026-05-10T12:33:47.441064+00:00
The 30 best shopping and stores in Addis Ababa,https://wanderlog.com/list/geoCategory/168730/best-shopping-and-stores-in-addis-ababa,"Edna Mall, located in the trendy Bole Sub-city of Addis Ababa, has been a popular urban shopping and entertainment center since 2008. The area is known for its modern vibe with numerous shopping centers, upscale Ethiopian restaurants, and international dining options.",Supermarket,Bole,"Address: Bole Medhanialem, Addis Ababa",,,https://www.google.com/maps/search/?api=1&query=The+30+best+shopping+and+stores+in+Addis+Ababa+Bole+Addis+Ababa+Ethiopia,https://t.me/musicalinstrumentsethiopia | https://t.me/wen0934,2026-05-10T12:33:47.441064+00:00
Ethiopia 2007 | PDF | Supermarket | Retail,https://www.scribd.com/document/67451932/Ethiopia2007,"Ethiopia2007 - Free download as PDF File (.pdf), Text File (.txt) or read online for free. 1. The document discusses trends in the growth of modern retail and wholesale chains in Ethiopia, including the emergence of supermarkets and large commercial farms. 2. While traditionally small-scale ...",Supermarket,Bole,,,,https://www.google.com/maps/search/?api=1&query=Ethiopia+2007+%7C+PDF+%7C+Supermarket+%7C+Retail+Bole+Addis+Ababa+Ethiopia,,2026-05-10T12:33:47.441064+00:00
online shopping in Ethiopia : Addisber,https://addisber.com/,Addisber.com is your reliable online shopping in Ethiopian. visit our online shopping site to find a wide range of products in Ethiopia.,Supermarket,Bole,,,,https://www.google.com/maps/search/?api=1&query=online+shopping+in+Ethiopia+%3A+Addisber+Bole+Addis+Ababa+Ethiopia,,2026-05-10T12:33:47.441064+00:00
Ethiopian malls and shopping centres | SkyscraperCity Forum,https://www.skyscrapercity.com/threads/ethiopian-malls-and-shopping-centres.1303613/,lets post pictures and news of Ethiopian malls that are open and U/C,Supermarket,Bole,,,,https://www.google.com/maps/search/?api=1&query=Ethiopian+malls+and+shopping+centres+%7C+SkyscraperCity+Forum+Bole+Addis+Ababa+Ethiopia,,2026-05-10T12:33:47.441064+00:00
Ethiopia pushes retail door ajar to foreigners | Reuters,https://www.reuters.com/article/world/ethiopia-pushes-retail-door-ajar-to-foreigners-idUSKBN0E60X3/,"But I&#x27;d love to trade in Ethiopia,&quot; Mark Turner, Massmart&#x27;s Africa director told Reuters. &quot;They&#x27;d welcome wholesale operations and that&#x27;s just not an option for us.&quot; In Addis Ababa, Turner&#x27;s loss is regarded as a temporary reprieve for the local supermarkets in new city centre malls, without the logistic networks of a big chain. &quot;We would suffer,&quot; said one supermarket manager, barricaded in a pokey office behind piles of imported Chinese furniture in the upmarket Bole ...",Supermarket,Bole,,,,https://www.google.com/maps/search/?api=1&query=Ethiopia+pushes+retail+door+ajar+to+foreigners+%7C+Reuters+Bole+Addis+Ababa+Ethiopia,,2026-05-10T12:33:47.441064+00:00
Addis Ababa Grocery - Grocery store in Columbus - Website,https://addis-ababa-grocery.com-place.com/,"Addis Ababa Grocery offers an authentic Ethiopian grocery shopping experience, serving as a go-to destination for traditional Ethiopian food staples in Columbus",Supermarket,Bole,,,,https://www.google.com/maps/search/?api=1&query=Addis+Ababa+Grocery+-+Grocery+store+in+Columbus+-+Website+Bole+Addis+Ababa+Ethiopia,https://614sneaker.com-place.com | https://addis-ababa-grocery.com-place.com | https://addis-ababa-grocery.com-place.com/about | https://addis-ababa-grocery.com-place.com/photos | https://addis-ababa-grocery.com-place.com/services | https://addis-ababa-grocery.com-place.com/suggestion | https://bckermanns-country-market.com-place.com | https://com-place.com | https://cruisin-classics-auto-sales.com-place.com | https://halal-market-med-mart-mediterranean-mart.com-place.com,2026-05-10T12:33:47.441064+00:00
Korean Supermarket in Ethiopia,https://www.tiktok.com/discover/korean-supermarket-in-ethiopia?lang=en,We cannot provide a description for this page right now,Supermarket,Bole,,,,https://www.google.com/maps/search/?api=1&query=Korean+Supermarket+in+Ethiopia+Bole+Addis+Ababa+Ethiopia,,2026-05-10T12:33:50.048108+00:00
Supermarkets in Ethiopia | AddisBiz.com (አዲስ ቢዝ) - Ethiopian Business Directory and Portal,https://addisbiz.com/business-directory/shopping/supermarkets?vm=amp&page=4,List of Supermarkets in Ethiopia | AddisBiz.com (አዲስ ቢዝ) - Ethiopian Business Directory and Portal,Supermarket,Bole,,,,https://www.google.com/maps/search/?api=1&query=Supermarkets+in+Ethiopia+%7C+AddisBiz.com+%28%E1%8A%A0%E1%8B%B2%E1%88%B5+%E1%89%A2%E1%8B%9D%29+-+Ethiopian+Business+Directory+and+Portal+Bole+Addis+Ababa+Ethiopia,https://facebook.com | https://instagram.com | https://twitter.com,2026-05-10T12:33:50.048108+00:00
"Addis Ababa City Guide – Sights, Food & History",https://www.kupi.com/en-ae/explore/ethiopia/addis-ababa,"Reaching the Ethiopian capital is relatively straightforward, as it serves as a major aviation hub for East Africa. Most international visitors will arrive by air, landing directly in the city. For a detailed overview of all travel options, including land routes, you can read more about how to get to Addis Ababa. The primary entry point for travelers is Addis Ababa Bole ...",Supermarket,Bole,,,,https://www.google.com/maps/search/?api=1&query=Addis+Ababa+City+Guide+%E2%80%93+Sights%2C+Food+%26+History+Bole+Addis+Ababa+Ethiopia,https://app.appsflyer.com/com.kupi?pid=kupi.com&c=main_page_footer | https://app.appsflyer.com/com.kupi?pid=kupi.com&c=main_page_header | https://app.appsflyer.com/id6472042342?pid=kupi.com&c=main_page_footer | https://app.appsflyer.com/id6472042342?pid=kupi.com&c=main_page_header | https://www.kupi.com/ | https://www.kupi.com/agreement | https://www.kupi.com/airlines | https://www.kupi.com/cities | https://www.kupi.com/confidential | https://www.kupi.com/contacts,2026-05-10T12:33:50.048108+00:00
The 38 best coffee shops and best cafes in Addis Ababa,https://wanderlog.com/list/geoCategory/18218/best-coffee-shops-and-best-cafes-in-addis-ababa,"I had an excellent experience at the Golden Tulip Addis Ababa Hotel. The property is perfectly located near Bole International Airport and in the heart of the business district. My room was spotless, comfortable, and had strong WiFi, great water pressure, and one of the best beds I’ve slept in while traveling. The breakfast buffet was outstanding, with both Ethiopian ...",Supermarket,Bole,Cameroon Street,,,https://www.google.com/maps/search/?api=1&query=The+38+best+coffee+shops+and+best+cafes+in+Addis+Ababa+Bole+Addis+Ababa+Ethiopia,http://akkoocoffee.com/ | http://galanicoffee.com/ | http://mamokachaplc.com/ | http://www.abatcoffee.com/ | http://www.cafe-live.com/ | http://www.filicoffee.com/ | http://www.gardenofcoffee.com/ | http://www.tomocacoffee.com/ | http://www.totottraditionalrestaurant.com/service | http://www.zingcoffeecenter.com/,2026-05-10T12:33:50.048108+00:00
Africa’s biggest airport is being built in Ethiopia for $12.5 billion | CNN,https://www.cnn.com/travel/africas-biggest-airport-is-being-built-in-ethiopia-for-usd12-5-billion-spc,"ZHA says each pier draws on a different Ethiopian landscape, from lush highland forests to arid eastern terrain, through their materials, colors and gardens with native plants. ... Bishoftu&#x27;s mild highland climate allowed a design with naturally ventilated walkways and courtyards. &quot;You&#x27;re literally outdoors, which is quite unique for an airport,&quot; said Ceccato. ... The airport will be almost 400 meters in elevation lower than Addis Ababa’s Bole ...",Supermarket,Bole,,,,https://www.google.com/maps/search/?api=1&query=Africa%E2%80%99s+biggest+airport+is+being+built+in+Ethiopia+for+%2412.5+billion+%7C+CNN+Bole+Addis+Ababa+Ethiopia,https://facebook.com/cnntravel | https://instagram.com/cnntravel | https://twitter.com/cnntravel,2026-05-10T12:33:50.048108+00:00
"From Imports to Independence: Tulefa Ceramic, Ethiopia’s Construction Revolution – New Business Ethiopia",https://newbusinessethiopia.com/construction/from-imports-to-independence-tulefa-ceramic-ethiopias-construction-revolution/,"Ethiopia’s construction sector has been expanding at double-digit growth rates, driven by urbanization and infrastructure investment. The Bishoftu International Airport alone is expected to be Africa’s largest aviation hub, easing congestion at Addis Ababa Bole International Airport and ...",Supermarket,Bole,,+251951444442,,https://www.google.com/maps/search/?api=1&query=From+Imports+to+Independence%3A+Tulefa+Ceramic%2C+Ethiopia%E2%80%99s+Construction+Revolution+%E2%80%93+New+Business+Ethiopia+Bole+Addis+Ababa+Ethiopia,https://t.me/TulefaCeramic | https://web.facebook.com/profile.php?id=61569103493605 | https://www.linkedin.com/company/tulefa-ceramic?trk=public_post_feed-actor-name,2026-05-10T12:33:50.048633+00:00
Axum Hotel | Mekele,https://_dc-mx.e2cdb4d41012.ethiovisit.com/hotels/axum-hotel/249/,"Axum hotel is situated at the heart of Addis Ababa, on the area looking over commanding panoramic view over Bole, the Hotel enjoys one of the finest locations in the city. Nearby amenities include International Banks, supermarkets, day spas, and others.",Supermarket,Bole,,,,https://www.google.com/maps/search/?api=1&query=Axum+Hotel+%7C+Mekele+Bole+Addis+Ababa+Ethiopia,,2026-05-10T12:33:50.048633+00:00
Travel advice and advisories for Ethiopia,https://travel.gc.ca/destinations/ethiopia,Travel Advice and Advisories from the Government of Canada,Supermarket,Bole,,,,https://www.google.com/maps/search/?api=1&query=Travel+advice+and+advisories+for+Ethiopia+Bole+Addis+Ababa+Ethiopia,https://www.facebook.com/CanadaEthiopia/,2026-05-10T12:33:50.048633+00:00
Ethiopia Vacation Rentals (4.9 out of 5) - Airbnb,https://www.airbnb.com/ethiopia/stays/apartments,"Find the perfect apartment rental for your trip to Ethiopia. Weekly apartment rentals, private apartment rentals, apartment rentals with a hot tub, and family-friendly apartment rentals. Find and book unique apartments on Airbnb.",Supermarket,Bole,,,,https://www.google.com/maps/search/?api=1&query=Ethiopia+Vacation+Rentals+%284.9+out+of+5%29+-+Airbnb+Bole+Addis+Ababa+Ethiopia,https://instagram.com/airbnb/ | https://twitter.com/airbnb | https://www.facebook.com/airbnb,2026-05-10T12:33:50.048633+00:00
"Uptake, adverse effect, and associated factors of COVID-19 vaccine among those living with human immunodeficiency virus, at Bole sub-city health facility Addis Ababa, Ethiopia - PMC",https://pmc.ncbi.nlm.nih.gov/articles/PMC11409500/,"In this study, we aimed to investigate the uptake rate and adverse effects of COVID-19 vaccination and associated factors among people living with the human immunodeficiency virus in Addis Ababa, Ethiopia. The Cross-Sectional study design was applied to the Addis Ababa Bole sub-city administration, ...",Supermarket,Bole,,,,https://www.google.com/maps/search/?api=1&query=Uptake%2C+adverse+effect%2C+and+associated+factors+of+COVID-19+vaccine+among+those+living+with+human+immunodeficiency+virus%2C+at+Bole+sub-city+health+facility+Addis+Ababa%2C+Ethiopia+-+PMC+Bole+Addis+Ababa+Ethiopia,,2026-05-10T12:33:50.048633+00:00
"Hotel Boutique Elmos - Meskel Flower 【 Addis Ababa, Ethiopia 】 Casai.com",https://www.casai.com/property/hotel-boutique-elmos-meskel-flower/BC-15306504,"Relax with Casai.com 【 Hotel Boutique Elmos - Meskel Flower 】 37 Bedrooms Rental in Addis Ababa, Ethiopia. Easily Compare Private Villas, Holiday Homes, Resorts, and rentals",Supermarket,Bole,,,,https://www.google.com/maps/search/?api=1&query=Hotel+Boutique+Elmos+-+Meskel+Flower+%E3%80%90+Addis+Ababa%2C+Ethiopia+%E3%80%91+Casai.com+Bole+Addis+Ababa+Ethiopia,https://www.facebook.com/CuratedByCasai | https://www.instagram.com/curatedbycasai | https://www.linkedin.com/company/curatedbycasai,2026-05-10T12:33:50.048633+00:00
ET100 Flight Status Ethiopian Airlines: Addis Ababa to Ethiopia (ETH100),https://www.airportia.com/flights/et100/addis-ababa/ethiopia/,"Ethiopian Airlines Flight ET100 connects Addis Ababa, Ethiopia to Ethiopia, Ethiopia, taking off from Addis Ababa Bole Airport ADD and landing at Mekele Airport MQX.",Supermarket,Bole,,,,https://www.google.com/maps/search/?api=1&query=ET100+Flight+Status+Ethiopian+Airlines%3A+Addis+Ababa+to+Ethiopia+%28ETH100%29+Bole+Addis+Ababa+Ethiopia,,2026-05-10T12:33:50.048633+00:00
"Commercial premises in Kirkos, Addis Ababa",https://ethiopia-streets.openalfa.com/kirkos/shopping,BeteGebeya Ras Mekonnen Avenue Addis Ababa Email: tigisthaile2719@gmail.com Opening hours: 24/7,Supermarket,Kirkos,,+251913705950,,https://www.google.com/maps/search/?api=1&query=Commercial+premises+in+Kirkos%2C+Addis+Ababa+Kirkos+Addis+Ababa+Ethiopia,http://www.openstreetmap.org/copyright | https://ethiopia-streets.openalfa.com/ | https://ethiopia-streets.openalfa.com/addis-ababa | https://ethiopia-streets.openalfa.com/cities | https://ethiopia-streets.openalfa.com/contact-us | https://ethiopia-streets.openalfa.com/kirkos | https://ethiopia-streets.openalfa.com/kirkos/accommodation | https://ethiopia-streets.openalfa.com/kirkos/banks | https://ethiopia-streets.openalfa.com/kirkos/car-services | https://ethiopia-streets.openalfa.com/kirkos/eating-drinking,2026-05-10T12:33:52.895394+00:00
"Central Super Market (Supermarket) (Kirkos, Addis Ababa, Ethiopia)",https://www.addismap.com/p-268810/central-super-market,"Take AddisMap with you - GARMIN ... Reserve hotel a hotel room online on AddisMap. List of hotels Hassle free - online booking in any hotel · Central Super Market (Supermarket) Wello Sefer Kirkos, House No. 300 Addis Ababa, Ethiopia...",Supermarket,Kirkos,,,,https://www.google.com/maps/search/?api=1&query=Central+Super+Market+%28Supermarket%29+%28Kirkos%2C+Addis+Ababa%2C+Ethiopia%29+Kirkos+Addis+Ababa+Ethiopia,http://www.addismap.com/ | http://www.addismap.com/#16/8.9938974/38.7743354 | https://www.addismap.com/#advertiseModal | https://www.addismap.com/downloads | https://www.addismap.com/hotels | https://www.addismap.com/p-234932/awole-sook | https://www.addismap.com/p-249014/yakob-sook | https://www.addismap.com/p-253124/jemal-sook | https://www.addismap.com/p-257584/coca-cola-kiosk | https://www.addismap.com/p-277224/median-caf%C3%A9,2026-05-10T12:33:52.895394+00:00
Shoa.Supermarket - Exploring Shopping in Addis Ababa,https://www.tiktok.com/@shoa.supermarket/video/7483514491125157125,TikTok video from Shoa.Supermarket (@shoa.supermarket),Supermarket,Kirkos,,,,https://www.google.com/maps/search/?api=1&query=Shoa.Supermarket+-+Exploring+Shopping+in+Addis+Ababa+Kirkos+Addis+Ababa+Ethiopia,,2026-05-10T12:33:58.236479+00:00
List Of Supermarkets in Addis Ababa,https://rentechdigital.com/smartscraper/business-report-details/ethiopia/addis-ababa/list-of-supermarkets-in-addis-ababa,Download the list of Supermarkets in Addis Ababa. Smartscrapers provides an accurate directory and the latest data on the number of Supermarkets in Addis Ababa,Supermarket,Kirkos,,,,https://www.google.com/maps/search/?api=1&query=List+Of+Supermarkets+in+Addis+Ababa+Kirkos+Addis+Ababa+Ethiopia,https://twitter.com/DigitalRentech | https://www.facebook.com/RentechDigital/ | https://www.instagram.com/rentechdigital/ | https://www.linkedin.com/company/rentech-digital,2026-05-10T12:33:58.237494+00:00
Supermarkets in Addis-ababa Ethiopia | AddisBiz.com (አዲስ ቢዝ) - Ethiopian Business Directory and Portal,https://addisbiz.com/business-directory/shopping/supermarkets?city=addis-ababa&page=2,List of Supermarkets in Addis-ababa Ethiopia | AddisBiz.com (አዲስ ቢዝ) - Ethiopian Business Directory and Portal,Supermarket,Kirkos,,,,https://www.google.com/maps/search/?api=1&query=Supermarkets+in+Addis-ababa+Ethiopia+%7C+AddisBiz.com+%28%E1%8A%A0%E1%8B%B2%E1%88%B5+%E1%89%A2%E1%8B%9D%29+-+Ethiopian+Business+Directory+and+Portal+Kirkos+Addis+Ababa+Ethiopia,https://facebook.com | https://instagram.com | https://twitter.com,2026-05-10T12:34:00.840657+00:00
Bambi's Grocery - in Addis Ababa - LikeALocal Guide,https://www.likealocalguide.com/addis-ababa/bambis-grocery,Bambis Super Market is one of the oldest and best supermarkets in Addis Ababa. It is preferred for its central location in the city and a great collection of th,Supermarket,Kirkos,in the city and a great collection of th Bambis Super Market,,,https://www.google.com/maps/search/?api=1&query=Bambi%27s+Grocery+-+in+Addis+Ababa+-+LikeALocal+Guide+Kirkos+Addis+Ababa+Ethiopia,https://www.likealocalguide.com/addis-ababa | https://www.likealocalguide.com/addis-ababa/eating | https://www.likealocalguide.com/addis-ababa/nightlife | https://www.likealocalguide.com/addis-ababa/shopping | https://www.likealocalguide.com/addis-ababa/things-to-do | https://www.likealocalguide.com/addis-ababa/tours | https://www.likealocalguide.com/blog | https://www.likealocalguide.com/join-as-tour-provider | https://www.likealocalguide.com/pages/contact | https://www.likealocalguide.com/pages/privacy,2026-05-10T12:34:00.840657+00:00
"11 Best Hotels in Kirkos, Addis Ababa",https://www.agoda.com/kirkos/maps/addis-ababa-et.html,We cannot provide a description for this page right now,Supermarket,Kirkos,,,,https://www.google.com/maps/search/?api=1&query=11+Best+Hotels+in+Kirkos%2C+Addis+Ababa+Kirkos+Addis+Ababa+Ethiopia,,2026-05-10T12:34:00.840657+00:00
Showa Supermarket in Ethiopia,https://www.tiktok.com/discover/showa-supermarket-in-ethiopia?lang=en,TikTok Shop is now available on web · Browse your favorite items · TikTok · Log in · Search · For You · Explore · Following · Upload,Supermarket,Kirkos,,,,https://www.google.com/maps/search/?api=1&query=Showa+Supermarket+in+Ethiopia+Kirkos+Addis+Ababa+Ethiopia,,2026-05-10T12:34:00.842164+00:00
Top 126 Supermarkets in Ethiopia - Mar 2025,https://www.ethyp.com/category/Supermarkets,"Search results of Top 126 Supermarkets in Ethiopia, near me. Listings are verified with accurate business information.",Supermarket,Kirkos,,,,https://www.google.com/maps/search/?api=1&query=Top+126+Supermarkets+in+Ethiopia+-+Mar+2025+Kirkos+Addis+Ababa+Ethiopia,https://www.facebook.com/I-Love-Ethiopia-107975795124980 | https://www.linkedin.com/company/ethiopia-business-directory/,2026-05-10T12:34:03.435308+00:00
Kirkos: The Cultural Crossroads of Addis Ababa,https://evendo.com/locations/ethiopia/addis-ababa/kirkos,"Kirkos is one of the most vibrant neighbourhoods in Addis Ababa, Ethiopia&#x27;s bustling capital. Nestled in the heart of the city, Kirkos offers tourists a unique blend of historical significance and modern-day allure. The area is home to many of Addis Ababa&#x27;s landmarks, making it an ideal starting ...",Supermarket,Kirkos,,,,https://www.google.com/maps/search/?api=1&query=Kirkos%3A+The+Cultural+Crossroads+of+Addis+Ababa+Kirkos+Addis+Ababa+Ethiopia,https://www.facebook.com/evendo.global/ | https://www.instagram.com/evendo_events/,2026-05-10T12:34:03.435835+00:00
Explore Arada Mart's Offerings in Addis Ababa: Your Local Grocery Hub Addis,https://www.aradamart.net/post/explore-arada-mart-s-offerings-in-addis-ababa-your-local-grocery-hub-addis,"Addis Ababa is a bustling city with a growing demand for quality groceries and household essentials. If you are looking for a convenient place to shop for fresh produce, everyday staples, and unique local products, Arada Mart is a name you should know. This local grocery hub in Addis Ababa ...",Supermarket,Kirkos,,,,https://www.google.com/maps/search/?api=1&query=Explore+Arada+Mart%27s+Offerings+in+Addis+Ababa%3A+Your+Local+Grocery+Hub+Addis+Kirkos+Addis+Ababa+Ethiopia,http://t.me/Arada_Mart | https://www.facebook.com/aradamart.net | https://www.linkedin.com/company/aradamart | https://www.twitter.com/aradamart,2026-05-10T12:34:03.435835+00:00
"Top 94 Supermarkets in Addis Ababa, Ethiopia. Page 5 - Apr 2026",https://www.ethyp.com/category/Supermarkets/5/city:Addis_Ababa,"Search results of Top 94 Supermarkets in Addis Ababa, Ethiopia, near me. Listings are verified with accurate business information.",Supermarket,Kirkos,,,,https://www.google.com/maps/search/?api=1&query=Top+94+Supermarkets+in+Addis+Ababa%2C+Ethiopia.+Page+5+-+Apr+2026+Kirkos+Addis+Ababa+Ethiopia,https://www.facebook.com/I-Love-Ethiopia-107975795124980 | https://www.linkedin.com/company/ethiopia-business-directory/,2026-05-10T12:34:03.435835+00:00
"Addis Ababa Ethiopian Grocery & Cafe, 4144 E Ponce de Leon Ave, Clarkston, GA 30021, US - MapQuest",https://www.mapquest.com/us/georgia/addis-ababa-ethiopian-grocery-cafe-695652229,"Get more information for Addis Ababa Ethiopian Grocery &amp; Cafe in Clarkston, GA. See reviews, map, get the address, and find directions.",Supermarket,Kirkos,,,,https://www.google.com/maps/search/?api=1&query=Addis+Ababa+Ethiopian+Grocery+%26+Cafe%2C+4144+E+Ponce+de+Leon+Ave%2C+Clarkston%2C+GA+30021%2C+US+-+MapQuest+Kirkos+Addis+Ababa+Ethiopia,,2026-05-10T12:34:03.435835+00:00
